language,speaker_id,PRR,length,sentence,keywords
es,290,100,9.84,y el grupo popular digamos que no ha concretado que es exactamente o qué modelo lingüístico o qué formula lingüística o qué política lingüística defiende,TRUE
es,353,100,3.71,vive en vitoria con un entorno sociolingüístico específico,TRUE
es,353,100,7.51,y existe de verdad una voluntad política para reforzarlos en función también del desarrollo de esa ley de aprendizaje,TRUE
es,290,98.99,9.11,eso es respeto aplicar o proponer multas lingüísticas para ustedes eso es respeto impedir que empresas puedan acceder,TRUE
es,290,100,10.35,subsistemas en algunos de los cuales se han implantado políticas de imposición lingüística que tratan a la lengua común como si fuera una lengua extranjera negando incluso,TRUE
es,6,100,10.1,de presencia vehicular en la escuela con respecto al euskera el éxito está bastante garantizado y nosotros se lo planteamos a usted y usted dijo que no,TRUE
es,128,100,3.45,mejora notablemente los resultados en su aprendizaje,TRUE
es,473,99.15,9.49,y equitativa entre el euskera y el castellano parafraseando algunas de las ideas vertidas por la consejera de educación política lingüística,TRUE
es,533,80,4.81,en latín no en euskera en la que,TRUE
es,497,100,3.72,no para eliminar perfiles primero para garantizar el uso del euskera,TRUE
es,93,98.92,5.43,en el primer plan de euskera de la ertzaintza que usted ha mostrado hay un grupo de trabajo para mejorar estos aspectos,TRUE
es,483,100,10.39,que vaya en consonancia no solo con la realidad sociolingüística sino que en el ámbito de las competencias comunicativas que se requieren para el desarrollo de las distintas actividades y funciones,TRUE
es,353,100,10.07,también en ocho ayuntamientos dirigidos por bildu la exigencia del euskera a la hora de recibir subvenciones tres se han resuelto a favor,TRUE
es,189,98.75,7.02,a la administración lo hagamos unas veces en euskera u otras en castellano desde nuestra absoluta,TRUE
es,526,100,10.19,si los derechos lingüísticos y culturales de este país de euskadi no son respetados nosotros vamos a ser muy contundentes como lo hemos sido,TRUE
es,290,100,10.19,cosa que entendemos es perfectamente comprensible y de sentido común proponemos que este parlamento inste a la dirección general de e i te be a que en el desarrollo de su plan de euskera,TRUE
es,290,100,9.83,llamada normalización lingüística del conjunto de la sociedad vasca estamos por tanto ante una nueva vuelta de tuerca que pretende dar continuidad,TRUE
es,462,100,8.75,lingüístico acreditado en plazas de euskera preceptivo y que sea obligatorio trasladar la necesidad y su justificación a la dirección de recursos humanos,TRUE
es,88,100,5.77,de cultura y política lingüística esta segunda fase del plan kultura auzolanean con,TRUE
es,0,100,9.86,no a los modelos lingüísticos y sí al derecho a decidir en los centros educativos el proyecto lingüístico de su propio centro mila esker eskerrik asko macazaga,TRUE
es,535,100,10.37,para que toda persona que quiera pueda conocer y aprender los idiomas oficiales y tengan la oportunidad de ello sin imposiciones ni condicionamientos esaten duzue,TRUE
es,130,100,9.12,algo que a través de los medios de comunicación hasta el propio lehendakari ha solicitado y de otro lado pedimos que la consejera de educación política lingüística y cultura,TRUE
es,483,100,9.76,los partidos debemos apostar porque derechos lingüísticos acceso a la función pública y convivencia en las dos lenguas sean los objetivos prioritarios,TRUE
es,473,100,7.77,del uso del euskera en su artículo veintisiete establece que se fomentará el uso prioritario del euskera en la publicidad,TRUE
es,282,100,10.2,lo que entonces llamaban aplicar medidas de terrorismo ahora se llaman señorías hechos desafortunados cómo han cambiado el lenguaje,TRUE
es,353,99.26,9.86,evitar cualquier tipo de discusión o debate en relación con las políticas lingüísticas en nuestra comunidad seguir manteniendo este tema como un tema tabú al que es,TRUE
es,290,100,7.99,relájese no intenten imponer el euskera al conjunto de la sociedad relájense hablaban de,TRUE
es,494,100,10.34,la mejora la visión y la garantía de la perspectiva de género que informaba toda la ley y lo mismo ha ocurrido con el respeto y garantía de los derechos lingüísticos estaba,TRUE
es,290,100,10.28,para qué al menos reflexionen en los próximos días o semanas cuánto dinero se ha gastado en euskadi para el fomento del euskera en las últimas,TRUE
es,353,100,10.12,otras fórmulas complementarias a la de la escuela para que se puedan poner al día y alcanzar determinados niveles en euskera pero creemos que pueden,TRUE
es,290,100,7.33,accedieron a su plaza sin la exigencia del conocimiento del euskera con objetivos y plazos adaptados a las necesidades,TRUE
es,131,100,10.27,entran en la universidad la necesidad de tener que adaptar el profesorado a esa tendencia de alumnos y de alumnas competentes en tres idiomas antes,TRUE
es,467,100,6.94,como ya lo he hecho antes en euskera es que las ayudas a la conciliación de la vida familiar y laboral,TRUE
es,509,99,5.65,independientemente de la situación lingüística de las comarcas y del índice de euskaldunización de sus progenitores,TRUE
es,189,100,9.98,puede ser la normativa actualmente existente y se introduce en el texto mucha confusión en relación a que el euskera y el castellano son las dos lenguas oficiales,TRUE
es,290,98.81,5.76,destinadas al impulso y al fomento del euskera con los resultados que todos conocemos prácticamente,TRUE
es,463,100,7.03,la realización de evaluaciones de diagnóstico de los aprendizajes instrumentales de la competencia oral escrita y matemática tiene más sentido en tercero,TRUE
es,353,100,5.92,se lo puedo asegurar o sea la comunidad lingüística del euskera no está dispuesta a que sus referencias sean,TRUE
es,353,100,5.4,del euskera sino otras leyes por supuesto que ustedes están buscando incumplir otras leyes la constitución,TRUE
es,275,100,5.46,pero el idioma debe ser entendido como un instrumento de comunicación como una herramienta de integración,TRUE
es,433,100,9.77,promoción activa del uso del euskera convivencia basada en la igualdad el pluralismo y los derechos humanos memoria crítica del pasado y me dirijo,TRUE
es,309,100,9.82,con el criterio de uso de las traducciones yo comparto con usted y mi grupo comparte con usted la necesidad de revisar los perfiles lingüísticos,TRUE
es,505,100,4.37,que el euskera es lengua cooficial de nuestro país y por ello,TRUE
es,380,100,10.27,para la cultura vasca y específicamente para el euskera por lo tanto al ser algo que engloba todos estos elementos entendemos que el principal responsable,TRUE
es,553,91.36,4.99,en cuanto al gran valor pedagógico de esta herramienta en el aprendizaje de cualquier lengua,TRUE
es,290,100,6.35,sanidad sin embargo parece ser que todo lo que ha tenido que ver con el euskera ha estado al margen de cualquier tipo de,TRUE
es,353,100,9.58,si hay alguna autocrítica que hacer en las políticas lingüísticas del gobierno vasco o si efectivamente se quieren repetir los mismos errores si esto va a seguir siendo,TRUE
es,88,100,5.52,planificación lingüística en la formación profesional y respetando la estructura del modelo lingüístico,TRUE
es,474,100,5.8,de elección de los modelos lingüísticos que se pidieron,TRUE
es,99,100,5.75,finkatuko ez duena no como se hace en el anteproyecto en el que el euskera está por debajo del castellano,TRUE
es,189,96.92,3.86,se podía distinguir prácticamente o sea se distinguía perfectamente el idioma,TRUE
es,275,100,9.47,porque ninguna cadena privada probablemente va a apostar por una televisión en euskera y es como servicio público etb tiene que darlo,TRUE
es,353,100,9.94,en los tres territorios han hecho un esfuerzo enorme especialmente en los entornos sociolingüísticos donde el euskera prácticamente apenas tenía presencia quienes,TRUE
es,351,100,10.23,en el caso de los funcionarios de habilitación nacional se obvia cualquier referencia a la lengua propia de la comunidad quiere eso decir que el conocimiento del euskera no será un requisito,TRUE
es,540,98.13,6.58,hombre pues sí que reconocía digo yo la preocupación principal que era dar a conocer la diversidad cultural y lingüística de españa,TRUE
es,370,100,8.52,la reforma realiza una apuesta muy decidida por una formación profesional que favorezca el aprendizaje permanente de los trabajadores,TRUE
es,533,100,9.23,o cuál es el idioma que utilizan para relacionarse entre ellos cuando realmente pueden elegir de acuerdo con este dato el ochenta por ciento de los colegios al menos deberían tener modelo a,TRUE
es,128,93.5,9.05,superar los modelos lingüísticos para convertir todo en un modelo quinientos o quiere superar los modelos lingüísticos para que efectivamente sean,TRUE
es,530,100,10.39,se trata de decirlo alto y claro vivimos un proceso de persecución a cualquier atisbo de españolidad el euskera se ha convertido en una excusa para colocar a los suyos,TRUE
es,275,100,6.48,una e i te be que sea un instrumento al servicio de la sociedad vasca de la promoción de nuestra cultura del euskera,TRUE
es,540,95.04,9.12,pues plantea que el gobierno vasco tiene unas previsiones dicen muy optimistas en el lenguaje diplomático de los funcionarios de la eref siete coma nueve por ciento,TRUE
es,99,100,10.14,en cada centro se concretará la estructura de este modelo lingüístico y la distribución horaria de los tres idiomas teniendo en cuenta su proyecto lingüístico su entorno las circunstancias que rodean a cada ámbito profesional,TRUE
es,290,100,10.19,particular campaña sí su particular campaña contra el euskera porque no hay mejor forma de atacar el euskera que utilizarlo de manera,TRUE
es,290,96,3.67,y no repercute negativamente en el euskera ni en castellano,TRUE
es,290,100,10.33,enormes oportunidades para incrementar el presupuesto destinado al inglés y el presupuesto destinado a la mejora y al aprendizaje,TRUE
es,290,100,10.14,el gobierno nacionalista del pnv en marcha para la transformación lingüística y artificial y forzada del conjunto de la sociedad,TRUE
es,309,100,9.34,yo creo que el análisis de los perfiles lingüísticos vendrá y podremos acometerlo deberán analizarse y ordenarse para responder,TRUE
es,499,100,5.48,a la orden de la consejera de educación política lingüística y cultura de marzo de dos mil quince,TRUE
es,113,100,8.36,en el campo político jurídico y sociolingüístico con el que cuentan tanto el castellano como el francés en sus respectivos estados euskal hiztunak,TRUE
es,275,100,10.24,el papel que e i te be debe de tener en la enseñanza conocimiento y difusión del euskera ya está claro ya está recogido tanto en la propia ley de creación del ente como en el plan estratégico,TRUE
es,309,100,9.95,que son un número cerrado no podían ser liberados de su puesto de trabajo para aprender euskera porque eran insustituibles y en algunos puestos más insustituibles todavía,TRUE
es,508,96.15,3.98,como servicios social bomberos euskera infraestructuras,TRUE
es,463,96.25,3.55,como la elaboración de un plan de actuación para la distribución y difusión del cine en euskera,TRUE
es,99,96.69,8.97,las evaluaciones de diagnóstico se plantean para conocer la situación de partida del proceso de aprendizaje de abordar a cada caso y poder diseñar así una intervención educativa,TRUE
es,275,100,9.68,por qué porque la directora de eitb achaca el fracaso de las audiencias tanto en castellano como en euskera a la disminución del presupuesto,TRUE
es,535,100,10.36,desio duen etorkizuna por todo ello desde elkarrekin podemos izquierda unida apostamos por la superación del actual marco de modelos lingüísticos,TRUE
es,353,100,10.38,y que creemos que además pueden ser más eficaces que creemos en el euskera para la convivencia y sin imposiciones y que defendemos el euskera sí pero como decía,TRUE
es,355,100,10.04,para reforzar la capacitación lingüística y metodológica de los docentes y esto además es un cumplimiento de los objetivos de la unión europea para dos mil veinte,TRUE
es,380,95.83,3.81,yo le emplazo a que venga a discutir sobre el euskera que diga,TRUE
es,189,100,4.18,de esas políticas lingüísticas por parte de los señores nacionalistas por lo tanto señor maneiro,TRUE
es,485,100,4.47,una ley sobre el derecho de aprender euskera que dice cosas como,TRUE
es,131,100,10.35,universidad entre el gobierno y la universidad que recoge acciones para el impulso de la docencia en otros idiomas no oficiales entre los que se encuentran cómo no el idioma inglés,TRUE
es,464,94.78,7.5,de que se acreditan mérito y la capacidad en el ingreso se organicen muchos cursos de formación continua de aprendizaje a lo largo de la vida,TRUE
es,485,100,6.61,pero reflexionando sobre cuál es la causa la causa es haber hecho del euskera,TRUE
es,411,100,5.08,en la que se establece la provisión de recursos para facilitar el aprendizaje de la lengua de signos,TRUE
es,93,100,9.09,de los trámites informes y audiencias preceptivos tanto de la dirección de política lingüística de las administraciones públicas como,TRUE
es,473,100,10.38,es que la exigencia de un perfil la exigencia de la excelencia en el dominio oral o escrito del euskera no ha supuesto un aumento proporcional del uso,TRUE
es,189,100,9.86,desproporcionada del euskera en las ofertas públicas de empleo en las ofertas públicas de empleo además que se han anunciado ya para esta legislatura a través de distintas,TRUE
es,485,100,4.85,tengan afecto por el euskera y ellos lo cuentan y entonces me imagino,TRUE
es,530,100,8.86,de quienes han defendido con todos los medios a su alcance acabar con el español con todo símbolo de nuestra nación el euskera ha sido seña identitaria,TRUE
es,463,100,10.34,los factores que inciden en el uso del euskera son diversos la densidad de vasco hablantes la competencia relativa en euskera de los vascohablantes con respecto al castellano,TRUE
es,355,99,5.9,los medios en euskera tienen una ayuda importante extraordinaria que lo criticamos de cuatro coma ocho millónes de euros,TRUE
es,462,93.46,6.82,estamos acelerando el proceso de acreditación del perfil lingüístico segundo al colectivo de pediatras y médicos de familia,TRUE
es,189,100,7.72,de que alguien que obtenía un lugar treinta y cinco en las listas de contratación y que luego por el conocimiento y la valoración del euskera bajaba,TRUE
es,290,100,10.4,contrario hace algunos meses también en mayo se daba a conocer la estadística sobre los presupuestos y recursos públicos del euskera y se decía que el país vasco,TRUE
es,88,100,8.06,y en ese sentido nosotros presentamos la interpelación a la consejera de educación política lingüística y cultura,TRUE
es,468,95.24,4.88,y una formación de idiomas que hagan más fácil la incorporación de nuestros jóvenes al mercado laboral,TRUE
es,290,100,9.34,proponía avanzar hacia el plurilingüismo desde un bilingüismo real y efectivo con el euskera como eje decía con soluciones realistas y flexibles,TRUE
es,275,99.26,9.26,un nuevo retraso y no sabemos si se va a producir ese retraso porque ustedes que son maestros en la ambigüedad también en el lenguaje hablan de reordenar y reprogramar,TRUE
es,290,88.73,5.51,el mayor número de reuniones incluso internas en euskera y un largo etcétera,TRUE
es,364,100,3.55,fiscales y podemos entender lo he dicho en euskera,TRUE
es,462,100,3.93,incrementa la capacitación lingüística en euskera de los profesionales,TRUE
es,380,100,9.25,muy por encima de la realidad social de la planta lingüística de este país porque si se aplicaran las políticas lingüísticas en función,TRUE
es,290,100,9.71,las reuniones de trabajo de los servicios unidades grupos de trabajo o comisiones cuya lengua de trabajo de comunicación habitual sea el euskera se realizarán siempre en esta lengua no puede,TRUE
es,353,100,10.02,los niños son capaces eso lo sabemos bien todos no todos los niños son iguales no son todos capaces de aprender el euskera en dos años,TRUE
es,380,100,10.4,porque nos oponemos como siempre hemos hecho a la imposición de multas en relación al uso del euskera porque creemos que las sanciones perjudican al euskera y vulneran derechos,TRUE
es,353,92.31,3.49,del euskera un modus vivendi,TRUE
es,189,100,4.62,que se le dé al euskera de hecho y que este gobierno los gobiernos,TRUE
es,463,100,8.61,en definitiva señor oyarzabal el departamento de educación política lingüística y cultura del gobierno vasco ha dado todos los pasos necesarios para garantizar,TRUE
es,290,100,6.85,de igualdad entre lenguas pero es que permanentemente olvidan la situación del euskera de hace treinta años,TRUE
es,6,100,8.84,lo que permite atribuir al euskera hasta un sesenta por ciento en cualquier centro educativo como es el caso y más de un sesenta por ciento,TRUE
es,380,98.57,7.9,castellano como en euskera de eso hablaremos un poco más adelante fundamentalmente,TRUE
es,128,100,6.14,aprobó el decreto de exención de la necesidad de acreditación lingüística,TRUE
es,380,100,4.54,la promoción del euskera las medidas a favor de la producción del euskera con que,TRUE
es,353,56.48,9.28,idioma escolar del sistema educativo lo es al ser lengua oficial de araba,TRUE
es,275,98.06,6.87,ni la idiosincrasia lingüística tan dispar en muchas ocasiones en nuestra comunidad a nuestro juicio a la hora de planificar,TRUE
es,353,89.86,4.21,que están haciendo el esfuerzo por introducir en euskera en sus comunicaciones pero,TRUE
es,290,100,9.81,la situación de estrecheces presupuestarias en la que nos encontramos por lo tanto da la sensación de que para el fomento del euskera siempre hay recursos,TRUE
es,462,100,10.02,hay dos lenguas oficiales y que la legislación reconoce unos derechos lingüísticos a los ciudadanos y ciudadanas también conoce que con objeto de garantizar,TRUE
es,290,100,9.13,en euskera se establece un protocolo de bienvenida para los nuevos para darles a conocer que en e i te be se ha apostado por el euskera no se establece un protocolo,TRUE
es,505,96.08,4.2,es cuando dicen que su valoración la valoración del euskera,TRUE
es,88,100,6.47,lingüístico y hacer que la necesidad que la objetividad fueran las condiciones exigidas,TRUE
es,290,100,3.48,ustedes se confunden los perfiles lingüísticos existentes,TRUE
es,128,100,10.3,en nuestro sistema de obtención de acreditación lingüística y producir una mejora es cierto que a corto y medio plazo la necesidad de pasar,TRUE
es,305,91.54,6.13,es la retórica con la que envuelve su lenguaje la primera parte de su intervención ha sido eso una retórica para intentar justificar lo injustificable,TRUE
es,355,96.88,8.95,las referencias que se hacen al euskera debemos fortalecer también por supuesto el cuarto plan vasco universitario para que dé respuestas y propuestas,TRUE
es,355,100,10.29,lingüísticas académicas científicas de compresión lectora no el modelo educativo concreto podemos discutir por supuesto también sobre el modelo educativo vasco,TRUE
es,355,100,6.22,con una atención preferente al euskera y en un marco flexible donde se respeta la autonomía de los centros,TRUE
es,463,100,9.84,es cierto que se han detectado algunas discrepancias entre los datos de registro y las nóminas de personal dependiente del departamento de educación política lingüística y cultura del gobierno vasco,TRUE
es,487,100,10.14,un pacto alcanzado dentro del marco de la negociación colectiva que también recoge el devengo de pluses por idiomas por cooficialidad de lengua por festivo por nocturnidad,TRUE
es,128,100,10.14,con las horas de exposición a esta lengua algo que ocurre de forma similar en el caso del euskera hasta un límite de utilización como usted bien sabe lo que indica,TRUE
es,433,100,9.31,el esfuerzo de muchas personas la actitud de miles y miles de euskaldun berris todo esto ha situado al euskera en la vía de crecimiento,TRUE
es,463,100,9.66,entonces para ello nuestra tarea es elaborar un plan de trabajo un programa de actuación para avanzar en la mejora de las competencias lingüísticas del alumnado que deberá tener en cuenta los resultados de la evaluación,TRUE
es,544,96.97,6.28,para que el euskera ocupe el espacio en el ecosistema audiovisual que se merece,TRUE
es,353,100,10.09,siempre ha habido quien ha pretendido también con la excusa de la defensa de determinados derechos lingüísticos,TRUE
es,290,100,10.34,que hablaba hace quince o veinte años analicemos en todo caso qué es la agenda bien la agenda estratégica del euskera es el plan del gobierno para,TRUE
es,553,95.35,8.36,de la administración pública hay un montón de relaciones con la ciudadanía que no exigen obligatoriamente un conocimiento casi filológico del euskera,TRUE
es,489,97.83,5.71,porque mejor seguir formándose mejorar el idioma que estar aquí de brazos cruzados para ello políticas efectivas,TRUE
es,275,100,10.19,de informar en euskera es cierto que tal y como dice la iniciativa medios como la radio en euskera es cada vez más escuchada por más jóvenes en un contexto en el que cada vez,TRUE
es,309,100,9.71,nuestra sanidad nuestra educación nuestra protección social nuestra normalización lingüística o las de reconocimiento de las víctimas aquella ley fue polémica,TRUE
es,463,98,5.55,en cinco competencias competencia en comunicación lingüística en castellano en comunicación lingüística en euskera,TRUE
es,290,100,10.2,para incrementar la autonomía de los centros docentes para mejorar el aprendizaje de las lenguas extranjeras para introducir con contundencia y con claridad,TRUE
es,474,100,7.69,la formación que pidieron en el modelo lingüístico que pidieron yo realmente,TRUE
es,505,85.48,5.52,el euskera y otras cosas típicas pero hombre un poquito de seriedad,TRUE
es,487,100,9.68,hablen en euskera o trabajen en euskera me han hablado de la enfermedad mental de una forma muy intensa me han hablado de la situación de las mujeres de una forma,TRUE
es,499,100,10.35,subvención la dirección de promoción del euskera podrá solicitar cualquier otra información complementaria que considere oportuna este es el modo de proceder en la concesión,TRUE
es,485,100,10.33,si estamos hablando del aprendizaje de las lenguas para poder crear esa identidad europea lo que no podemos pensar es que el euskera,TRUE
es,128,88.73,4.96,de dos lenguas más porque obviamente ya le he dicho que el binomio euskera castellano,TRUE
es,310,100,10.36,el valor del euskera es enorme y así lo ha reconocido y lo reconoce la sociedad vasca a ver si aciertan dónde he oído estas palabras,TRUE
es,189,100,7.54,con el objetivo de adecuar la valoración de su conocimiento a la realidad sociolingüística de las zonas de la comunidad autónoma del país vasco es el mismo punto que firmó,TRUE
es,355,100,10.15,de criticar el euskera o de criticar la utilización que entiende usted que algunos hacen del euskera o al revés es decir para defender el euskera tampoco hace falta minorizar,TRUE
es,290,100,4.73,puedan tener conocimientos suficientes en euskera también es un buen,TRUE
es,533,97.75,5.34,se ha reducido también los niveles de uso del euskera es decir cuando a los alumnos les dejan elegir la lengua,TRUE
es,463,100,9.33,habitual de funcionamiento ni tampoco que se haga uso de una exigencia excesiva en torno al euskera como también usted en otras ocasiones ha reiterado,TRUE
es,290,100,7.85,la utilización de instalaciones públicas y garantizar que se cumplen los requisitos lingüísticos además de preguntas,TRUE
es,189,100,10.29,se habla del debate lingüístico de la política lingüística que para nosotros obviamente es manifiestamente mejorable a los resultados nos remitimos,TRUE
es,290,100,10.35,a conciudadanos por razones lingüísticas y proponemos también que este parlamento declare que el euskera ha tenido y tiene básicamente dos enemigos,TRUE
es,553,99.29,8.66,tenemos que vigilar con especial atención para evitar que el euskera se convierta en un elemento más de la brecha laboral programas formativos como los que ha lanzado lanbide,TRUE
es,530,100,8.35,e i te be y su política lingüística de e i te be ya hemos hablado mucho un ente público que solo parece ser de las formaciones que gobiernan,TRUE
es,462,92.06,3.6,diez barra ochenta y dos básica de normalización del uso del euskera y de la ley,TRUE
es,509,89.16,6.23,los tres modelos lingüísticos a b y quinientos la distribución en las redes al cincuenta por ciento,TRUE
es,530,100,10.39,parte de una falsedad que convierte en verdad incuestionable y la difunde además a los cuatro vientos por otro lado el euskera el idioma que ha sido bandera del independentismo violento,TRUE
es,353,97.87,4.35,he entrado en una tienda y no me han atendido en euskera que si,TRUE
es,353,100,10.28,con esta proposición de ley además amplían los supuestos sancionables extienden su ámbito de aplicación y las obligaciones lingüísticas a todo tipo de empresas,TRUE
es,553,100,6.88,y que no puede ser tratado con ligereza el euskera es hoy en día un factor de empleabilidad y no solo en el sector público,TRUE
es,485,100,9.7,de considerar que el euskera era una herramienta que había que trabajar y que era de las cosas más importantes en la educación,TRUE
es,487,100,8.06,abogados que hablaban en euskera y donde tuvimos la gran pega es que el cliente el administrado no,TRUE
es,462,100,6.79,del euskera a veces estamos cambiando y aplicando sin acuerdo sindical pero interpretando,TRUE
es,355,100,5.32,es decir garantizar de forma efectiva la elección del modelo lingüístico cuando haya demanda suficiente,TRUE
es,290,100,5.36,lingüística y artificial y forzada del conjunto de la sociedad,TRUE
