language,speaker_id,PRR,length,sentence,keywords
es,353,100,10.32,reafirmar para que ustedes no tergiversen nuestra posición y las palabras de aquellos que simplemente criticamos las políticas lingüísticas venimos a defender el euskera que queremos desde el grupo popular,TRUE
es,290,100,7.92,cuando un niño o un joven vasco aprende euskera el número de hablantes adicionales con los que puede comunicarse es cero,TRUE
es,474,96.81,4.95,tal y como ya he dicho en euskera el propio cuarto plan de familias incluye como principio de actuación entre otros,TRUE
es,189,100,9.65,los primeros párrafos hablan de modificar la normativa correspondiente a la asignación de los perfiles lingüísticos de cada puesto a revisar la puntuación del euskera en las futuras ope,TRUE
es,293,100,6.34,tan absolutamente amplios como el concepto de ecología lingüística con jornadas en defensa del euskera que yo por supuesto,TRUE
es,290,100,10.33,entre otras cosas se señalaba textualmente que el gobierno está trabajando en una propuesta de revisión de los modelos lingüísticos dirigida a que los alumnos mejoren sus competencias en euskera,TRUE
es,275,100,10.23,a la hora de distribuir los perfiles lingüísticos en cada una de las comisarias no se tiene en cuenta la realidad sociolingüística de las distintas zonas de euskadi y no se atiende porque en este momento los agentes euskaldunes,TRUE
es,505,100,5.57,deben velar por su cumplimiento por que los derechos lingüísticos puedan ser,TRUE
es,429,100,6.07,se pueda utilizar el euskera por qué no en estos momentos estamos en una situación contraria,TRUE
es,290,99.18,7.86,en el que sin duda alguna el inglés es también el idioma rey y es el desarrollo de internet que se ha consolidado como herramienta de negocio de comunicación,TRUE
es,290,98.82,4.97,en el que se establece los perfiles de euskera obligatorios para todo el personal al servicio del ente,TRUE
es,353,100,9.14,y nos diga si está dispuesto a seguir con este plan que obligaría e impondría la exigencia del euskera a todos los trabajadores de radio euskadi,TRUE
es,355,99.24,8.29,y a partir de entonces la política lingüística ha venido evolucionando el texto nuevo que se introdujo de la disposición final segunda de ese decreto dice así,TRUE
es,533,99.15,7.62,y el modelo a por su parte es la opción lingüística elegida por el tres coma cinco por ciento de las familias esto es una forma diría que nada sutil,TRUE
es,6,100,10.39,por lo tanto por qué no podemos hablar de esto de establecer un sesenta por ciento como mínimo de euskera en las escuelas,TRUE
es,463,76.19,5.59,hablar en euskera no es falta de respeto como no lo es hablar en castellano nosotros no le,TRUE
es,533,97.3,4.59,y claro y puede que haya gente que no quiera aprender euskera o tienen que aprenderlo a la fuerza,TRUE
es,533,100,9.09,de acuerdo mire nosotros queremos un modelo a con una asignatura en euskera que se dé bien,TRUE
es,290,100,8.62,invirtieron en dos mil doce gobierno socialista en la promoción del euskera al menos ciento cuarenta y seis coma tres millónes de euros,TRUE
es,509,100,9.58,tanto en resultados de competencia lingüística como en competencias básicas y cuál es la causa fundamentalmente la acumulación de aspectos relacionados con el,TRUE
es,353,100,4.92,un instrumento para la discriminación de ningún ciudadano en nuestro país euskera si,TRUE
es,128,100,10.34,contiene exigencias filológicas que si bien son absolutamente coherentes para un puesto de traductor o un puesto de profesor de euskera no lo son tanto para,TRUE
es,504,100,4.52,en esta revisión tomaremos en consideración aprendizajes derivados de la crisis sanitaria,TRUE
es,128,83.61,5.5,favorece el avance del euskera por ser otra lengua y esto está,TRUE
es,355,100,9.62,porque consideramos que el euskera y el inglés no suman cero el sistema educativo vasco tiene carácter bilingüe porque las dos lenguas cooficiales son nuestras,TRUE
es,434,100,9.88,que garantice la normalización lingüística y la cultura como motores de transformación social que se respeten nuestros derechos sexuales y reproductivos,TRUE
es,355,98.72,4.92,también hay que tener presente que preservar nuestro patrimonio lingüístico propio y cultural,TRUE
es,290,98.57,6.12,obsesiva pretensión de los talibanes lingüísticos de conseguir la transformación,TRUE
es,309,100,9.75,nace cojo el plan de euskera que ha aprobado la actual dirección de e i te be porque nunca ninguna dirección anterior lo aprobó nace desde un voluntarismo,TRUE
es,189,100,10.14,toda la política nacionalista del euskera en que nos quedamos solos y eso que era la misma iniciativa que apoyó el partido socialista la pasada legislatura pero mira si vamos a la fase de méritos,TRUE
es,47,100,10.16,como se están produciendo en algunos casos porque por mucho que se quiera retorcer el lenguaje son homenajes cuando una persona sale de la cárcel,TRUE
es,131,100,9.43,introducción del aprendizaje del castellano en el grado uno pero ahí yo creo que vamos más a cuestiones de criterio educativo claras,TRUE
es,423,99.04,6.54,y a quienes lo consienten y los responsables de que hasta los chavales en su gran mayoría matriculados en euskera en sus escuelas,TRUE
es,290,100,10.04,progresiva con el indispensable reforzamiento de la capacitación lingüística en inglés de los profesores cosa que obviamente requiere de compromisos presupuestarios,TRUE
es,189,100,8.15,la demanda del euskera desde luego no tiene que ver con otras zonas de nuestra comunidad autónoma o cómo plazas perfiladas,TRUE
es,290,100,5.58,de tal manera que estos perfiles lingüísticos se adecuaran a las exigencias,TRUE
es,353,100,8.33,en un momento en el que el euskera con el tratamiento que se le da de asignatura para la comunidad autónoma,TRUE
es,0,100,9.02,se pueda cumplir la petición aprobada por la comisión de cultura euskera y deporte eskerrik asko eskerrik asko zupiria jauna,TRUE
es,290,100,5.47,sectaria ni siquiera su actitud favorece al euskera al contrario,TRUE
es,290,100,10.02,la lengua de origen y ustedes consideran esto una imposición la imposición es lo suyo en todos los órdenes pero especialmente en el lingüístico,TRUE
es,355,98.8,6.08,hay que evitar cualquier problema que pueda generar a los alumnos un mal entorno de aprendizaje que cause,TRUE
es,353,98.8,6.02,enorme para que usted le atiendan por teléfono en euskera cuando llama a una administración pública,TRUE
es,309,98.9,7.72,debe de serlo y la mayoría de los puestos de trabajos tienen perfil lingüístico y por lo tanto el tema es además,TRUE
es,57,100,8.65,a continuar defendiendo el autogobierno de euskadi la calidad de nuestro sistema educativo y los derechos lingüísticos y educativos de la ciudadanía vasca,TRUE
es,380,100,10.39,dijo usted que la constitución española no apoyaba el euskera y yo le conteste claro que usted estaba pensando de forma voluntarista,TRUE
es,364,98.89,5.37,porque no les interesaba porque era mucho más fácil tener financiación gratis eta amore como se dice en euskera,TRUE
es,530,98.88,6.51,con pésimos resultados como estamos observando el euskera está claro que no puede generar discriminación,TRUE
es,462,100,10.31,de los ciudadanos y ciudadanas vascas vamos a apostar porque el euskera y el castellano puedan ser lenguas de servicio de comunicación,TRUE
es,353,100,5.04,para poder acceder a la plaza un nivel determinado un dominio del euskera,TRUE
es,88,100,9.75,tan grave es pedir a los ayuntamientos que redacten las actas en euskera y en castellano tan grave es,TRUE
es,553,100,9.96,pierde sentido más allá de los límites de cada tribu de cada grupo lingüístico y a veces incluso de una simple aldea y no crean sus señorías que,TRUE
es,473,100,7.83,euskaldunes o no son bastante accesibles orillando el tema lingüístico considerando a los escritores como son,TRUE
es,99,100,6.18,en la evaluación pero que han de ser claves a la hora de abordar cualquier propuesta de mejora de los modelos lingüísticos,TRUE
es,530,100,9.79,este gobierno insiste en gastar cada año más de siete millónes de euros la defensa del euskera que todo lo contamina y que en este caso sirve para condicionar la línea editorial,TRUE
es,128,100,4.19,cada quien lo que quiera porque de nuevo entraremos en la brecha lingüística,TRUE
es,189,97.8,6.73,conocimiento y uso del euskera se hace de los tres territorios no está garantizado el uso del euskera usted cree,TRUE
es,290,100,10.36,es lengua oficial porque todos los ciudadanos la conocen mientras que el euskera es lengua oficial y se decidió en su momento que el euskera fuera lengua oficial,TRUE
es,353,100,10.06,no hemos escuchado a nadie traer aquí el debate de los canales en euskera de las emisoras en euskera no,TRUE
es,88,100,4.66,podamos apoyar si se quiere discriminar a los que no saben euskera,TRUE
es,463,100,9.75,la seguridad de nuestros menores es la máxima prioridad del departamento de educación política lingüística y cultura en este caso ha estado garantizando en todo momento,TRUE
es,353,82.19,4.36,que ellos se preocupaban que no tuviesen ningún contacto y que todo se hacía en euskera eso,TRUE
es,474,100,9.58,en un ámbito como la formación profesional donde la normalización del uso del euskera va con retraso con respecto,TRUE
es,275,100,10.27,entonces a veces cuando se le pregunta a la dirección por cómo cumple esta misión pues simplemente lo que nos viene a decir es cuál es el número de horas que se emite en euskera,TRUE
es,509,100,4.22,presencia del euskera según las proyecciones en veinte años,TRUE
es,353,100,10.39,exclusivamente en euskera queremos suprimir los canales en castellano las emisoras en castellano queremos entrar al debate si sobran en este momento,TRUE
es,128,93.65,4.96,dicen ustedes norabide objetivos lingüísticos están en el curriculum,TRUE
es,290,100,10.29,no ha habido control sobre lo que se ha hecho en el fomento del euskera en los últimos años y en el futuro seguramente vaya a ser lo mismo por lo tanto se,TRUE
es,464,100,10.18,ya le he contestado no tengo ninguna intención en debatir con usted sobre alcance y contenido de unas declaraciones que se produjeron en euskera y que usted seguramente no entendió directamente,TRUE
es,353,100,10.36,enemigos del euskera se lo decían antes son estos nuevos talibanes de la lengua los nuevos talibanes de la lengua el nacionalismo radical de bildu que se pasa los consensos,TRUE
es,290,100,10.36,además recientemente la consejera aquí presente dijo que el departamento está estudiando aumentar el número de horas que se dediquen al euskera en el modelo a,TRUE
es,189,100,7.81,el sistema actual de perfiles lingüísticos a fin de que se pueda computar una capacitación en euskera,TRUE
es,388,100,10.28,para evitar problemas y garantizar un aprendizaje deportivo de calidad es indispensable que la figura del monitor se someta a una regulación formativa y profesional de su actividad,TRUE
es,380,96.08,4.72,sino los que son traducción del euskera o hablan de temas vascos,TRUE
es,189,98.65,4.1,consultas que se realizan en euskera no se han podido realizar en euskera ahí están los datos,TRUE
es,462,100,6.4,especialmente cuando se trata de servicios en euskera le voy a recordar algunas cuestiones que,TRUE
es,309,100,9.83,que esuna tarea que tienen que acometer todos y cada uno de los departamentos del gobierno todos y cada uno de los organismos autónomos trasladarlos a política lingüística y por lo tanto es por lo que,TRUE
es,353,100,3.7,competencias básicas dónde queda la ley de aprendizaje,TRUE
es,463,100,8.89,sobre todo en lo que respecta al euskera como los perfiles lingüísticos exigibles al profesorado o las necesidades formativas del mismo porque estaremos también de acuerdo,TRUE
es,499,98.53,4.06,en nombre del gobierno al departamento de cultura y política lingüística así es,TRUE
es,540,100,6.19,que todos los funcionarios individualmente hablen euskera para poder cumplir con este derecho que pueden tener las personas,TRUE
es,189,93.33,6.65,son necesarias este tipo de medidas para impulsar el uso de euskera en osakidetza eso no es progresividad señor consejero,TRUE
es,275,100,7.35,el euskera por encima de la situación laboral de esas personas es así ahora una cosa le quiero decir,TRUE
es,6,97.22,5.73,por lo tanto si eso es así si el déficit de adquisición de competencias está en el euskera,TRUE
es,88,100,9.54,es decir más exigencias más complejidades de gestión internacional los idiomas la adaptación a nuevas normativas,TRUE
es,130,100,9.54,y punto tres la riqueza de las distintas modalidades lingüísticas de españa es un patrimonio cultural que será objeto de especial respeto,TRUE
es,496,96.88,6.82,la adaptación de su oferta a la nueva realidad sociolingüística así como los cambios de y nuevos usos tecnológicos,TRUE
es,485,100,10.37,importancia comparativa y no es un problema de ustedes quieren el euskera o no porque mire tanto como yo el que quiera pero más que yo nadie,TRUE
es,309,100,7.71,encargado por el gobierno socialista y presentado por la actual consejera de educación y cultura de evaluación de los perfiles lingüísticos,TRUE
es,505,95.2,7.12,el tema de los perfiles lingüísticos bueno nosotros desde luego ahí no nos metemos este entendemos que no es el debate es un requisito más pero bueno sí que,TRUE
es,353,100,10.2,el fondo de esta cuestión es que aquí se están repartiendo la pasta los negocios de los amigos solo de los nacionalistas y utilizan el euskera como una excusa,TRUE
es,485,100,10.23,la promoción la enseñanza la inmersión en euskera y claro esos esfuerzos quitan,TRUE
es,533,97.33,4.36,ni en euskera ni en castellano y el cuarenta por ciento supera el nivel inicial en castellano,TRUE
es,189,100,9.4,garantizar el principio en condiciones de igualdad en el acceso a la función pública el euskera por lo tanto el conocimiento del euskera,TRUE
es,128,100,10.18,mucha preocupación por pensar que en un país democrático que tiene una política lingüística democrática pudiera haber esencias intocables,TRUE
es,355,100,9.25,o maldad de una ley solamente en función del impulso que se le dé a una determinada lengua en este caso el euskera porque entendemos que hay aspectos mucho más relevantes,TRUE
es,189,100,10.24,la motivación de aprender euskera y eso es lo que tenemos que conseguir cambiar y eso es lo que tiene que conseguir cambiar las políticas lingüísticas que igual hay que darle una vuelta a esas políticas impositivas,TRUE
es,353,88.33,4.7,de poder acceder a las escuelas oficiales de idiomas para las que,TRUE
es,290,100,4.34,en alguna otra ocasión he señalado en nuestra opinión el euskera ha tenido o tiene,TRUE
es,544,100,8.92,cuestión ya que desde hace tiempo estamos inmersas en la tarea de darle al euskera el valor que se merece y el de garantizar los derechos lingüísticos de toda la ciudadanía vasca,TRUE
es,290,100,4.27,con el aprendizaje de la lengua cooficial que se ignore,TRUE
es,355,100,8.3,y disposición de encontrar un territorio común que necesariamente vamos a tener que hacerlo porque si nos dedicamos a tirarnos el idioma a la cabeza,TRUE
es,474,100,10.13,que saben euskera pues probablemente muchos de nosotros no podríamos intervenir como habitualmente lo hacemos es decir eso discrimina,TRUE
es,380,100,10.22,vascas en cualquiera de nuestros dos idiomas euskera o castellano y si no tendría que ser únicamente de euskera por eso que no es el objeto de hoy,TRUE
es,532,100,10.24,lo dice usted que los modelos lingüísticos actuales han dado pie a una exclusión sistemática y estructural del derecho a estudiar en español falso,TRUE
es,290,100,9.91,y obviamente también en euskera y que hay que hacer los esfuerzos presupuestarios necesarios para que los profesores tengan día a día una mayor capacitación lingüística,TRUE
es,530,100,9.82,nulo como todos podemos comprobar señores del grupo popular ciudadanos después de cuarenta años de fallida política lingüística y de desmesurado gasto de dinero público,TRUE
es,290,100,10.34,en materia lingüística y cuáles son los excesos las vulneraciones de derechos incluso que se puedan producir como consecuencia de esas políticas,TRUE
es,481,100,5.84,basado en el aprendizaje permanente hoy este parlamento debate e impulsa estos puntos,TRUE
es,380,100,8.86,para garantizar todos los derechos lingüísticos de la ciudadanía y también al mismo tiempo y al mismo nivel la protección del euskera gracias,TRUE
es,88,93.33,4.12,el cine en euskera el archivo de danza,TRUE
es,353,100,3.71,las diferentes realidades socio lingüísticas de nuestra comunidad,TRUE
es,533,80.18,7.43,y que si hasta ahora la imposición del euskera era de tapadillo por la vía administrativa ahora será descarada y total,TRUE
es,275,100,6.57,entonces claro la propaganda hay que hacerla en euskera y en castellano pero a lo mejor es eso a lo mejor es que,TRUE
es,530,100,5.58,trabajaremos para hacer obligatorio a todos los alumnos que cursen la educación obligatoria en euskera,TRUE
es,189,100,4.57,prioridad es que la política lingüística y el euskera,TRUE
es,474,98,4.25,si se respeta la libertad de elección de modelo lingüístico,TRUE
es,290,100,5.23,en la agenda estratégica del euskera nosotros hemos querido completarla con,TRUE
es,467,100,9.29,muy limitada en este caso como decía en euskera a la viceconsejería de vivienda y la otra relacionada con la inspección de trabajo y la prevención de riesgos laborales,TRUE
es,88,100,10.21,y en relación también con los modelos lingüísticos a implementar en relación con los ciclos de formación profesional estamos ante una proposición,TRUE
es,57,99.37,10.38,en relación a los presupuestos del área de educación del departamento de educación política lingüística y cultura en el periodo de estudio dos mil trece dos mil quince debe tenerse en cuenta,TRUE
es,189,92.21,4.71,del euskera ya le digo que sería porque estaba en el gobierno vasco o porque también votó a favor,TRUE
es,531,100,4.73,apostar por la digitalización y la democratización de la enseñanza aprendizaje,TRUE
es,290,100,10.15,nosotros en todo caso no consideramos en absoluto prioritarias pero lo importante es el asunto de los perfiles lingüísticos lo importante y lo que nosotros rechazamos,TRUE
es,380,100,5.88,un consenso que ha sostenido el impresionante avance del euskera,TRUE
es,530,100,10.28,el idioma con el que se relacionan con la población y pese a los reiterados esfuerzos de este gobierno y de los anteriores incluido el del partido socialista los de mayor tirada,TRUE
es,88,100,7,funciones públicas no significa que en cualquier sitio en las que se vayan a llevar a cabo requieran la misma capacitación lingüística,TRUE
es,485,96.92,6.21,del euskera con la sociedad es un sacrilegio porque parece que ciertos grupos,TRUE
es,205,100,7.71,o médico euskaldún ya nadie cuestiona que los derechos lingüísticos sean parte inherente de la calidad que tiene que ofrecer,TRUE
es,128,100,4.6,y lo hace compatible con una dedicación preferente al euskera no es que el euskera sea,TRUE
es,353,100,7.29,el aprendizaje un elemento para la modernización y sobre todo también un elemento para la implicación,TRUE
es,483,100,6.96,niños y niñas que no aprenden el euskera en cuatro años la normativa y lo más importante aún que estas personas,TRUE
es,290,98.11,5.08,este hecho al revés he dicho esto en concreto que la emisión en euskera,TRUE
es,290,100,7.29,del país vasco lo que es cierto y llevamos denunciándolo desde que upyd está en este parlamento es la imposición lingüística,TRUE
es,473,93.85,3.72,en su informe de conclusiones entre otras cosas sobre perfiles lingüísticos,TRUE
es,353,100,10.04,hace ya mucho tiempo que el movimiento social del euskera se le fue de las manos está mucho más controlado por los sectores que trabajan día a día en las estrategias,TRUE
es,510,97.09,6.96,y como decía en euskera los abogados del gobierno vasco y de la diputación foral de bizkaia lo han ratificado con la acusación,TRUE
es,407,100,9.44,de la diferente capacidad de las familias y los sistemas educativos para ofrecer en esos primeros años de vida los estímulos y aprendizajes necesarios,TRUE
es,290,100,10.29,cuando resulta que no era necesario saber euskera para hacer perfectamente su trabajo expulsar de euskadi a miles de ciudadanos vascos,TRUE
es,355,100,10.2,y no podemos sesgar su educación desde niños porque puede repercutir negativamente a su desarrollo educativo o en sus relaciones humanas se pierden el aprendizaje de las relaciones humanas,TRUE
es,423,100,5.79,estableciendo a efectos de la utilización del euskera los principios básicos de programación,TRUE
es,310,100,8.97,y todo esto lo digo en castellano con acento vasco y a mucha honra ahora voy a hablar en euskera no con acento catalán que lo desconozco,TRUE
es,474,100,8.49,potencialmente creciente y eso no constituye ninguna discriminación hacia quién no conoce el euskera porque y me dirijo a los,TRUE
es,530,100,6.36,que además ya deberían de haber sido euskaldunizados de acuerdo con la imposición de su política lingüística en la educación,TRUE
es,189,92.73,4.45,en este caso lingüística y que va a ir más allá de querer impulsar el uso,TRUE
es,353,92.86,4.31,por qué no se va a reforzar la presencia del euskera en el modelo a si,TRUE
es,496,100,5.4,me gustaría resaltar señor sémper la falta de lenguaje inclusivo en su proposición de ley,TRUE
es,128,96.36,5.03,del aprendizaje de las lenguas europeas y triplica de esta manera,TRUE
es,540,100,3.64,y luego el tema del conocimiento del euskera hombre si luego,TRUE
es,128,100,5.48,pasa de ser una asignatura a ser el instrumento para el aprendizaje de otras materias es decir,TRUE
es,380,100,3.81,se incrementa el diez por ciento de los puntos a los proyectos en euskera,TRUE
es,355,100,8.92,contando con su aceptación previa y acompañada de los recursos económicos necesarios respecto al tratamiento del euskera consideramos que tanto este,TRUE
es,535,98.44,4.9,y el tiempo escolar es un tiempo valiosísimo para la inmersión lingüística y,TRUE
es,429,100,6.31,abuso nosotros lo que pretendemos en este y en general con el euskera,TRUE
es,473,100,6.13,que convoque el gobierno la valoración del conocimiento del euskera se adapte a la realidad socio lingüística,TRUE
es,380,100,9.87,pero estamos hablando de la política lingüística y si tiene que haber medios que por publicarse en euskera tienen que tener una ayuda y fíjese yo,TRUE
es,189,100,7.67,a la política lingüística en esta comunidad autónoma con la exigencia de que todo el mundo pueda acreditar un,TRUE
es,189,100,9.9,la formación y que también esa asignación y esa exigencia que hagamos del conocimiento del euskera se adecue,TRUE
es,508,100,10.38,no de servicio público meramente asistencial entre los cero y los tres años se sientan las bases del aprendizaje que permiten desarrollar,TRUE
es,463,93.55,4.12,opte cuando así lo desee porque la primera palabra sea en euskera entiéndalo,TRUE
es,505,100,10.36,y al igual que se vela por la igualdad de género un gobierno democrático no se puede permitir no velar por la igualdad de dos lenguas cooficiales porque además existen unos derechos lingüísticos,TRUE
es,290,100,10.31,lo más eficaz ni lo más incentivador para el fomento del euskera en el ámbito del consumo ni para el ejercicio efectivo de los derechos lingüísticos de las personas consumidoras,TRUE
es,48,98.02,5.49,que se implique a la financiación de la azoka ya que el euskera y la cultura en euskera no nos concierne solo al gobierno vasco,TRUE
es,290,100,3.4,seguimiento y evaluación la policía lingüística,TRUE
es,463,100,6.48,urbanismo vivienda política lingüística entre otras como le he dicho estamos implementando nuevas medidas,TRUE
es,509,98.65,5.89,un noventa por ciento de la población menos de veinte años será vascohablante no obstante,TRUE
es,463,99.16,7.75,y adjetivación el uso del lenguaje refleja la línea editorial de e i te be señor maneiro y este es sin duda una línea comprometida con los valores,TRUE
es,290,100,10.35,vulnerados eche la vista atrás observe la situación del euskera hace treinta años y la situación del euskera ahora analice el uso,TRUE
es,290,100,10.29,y actuara para impedir la entrada en vigor y por lo tanto la imposición de esas multas lingüísticas aquel gobierno del señor lópez ni siquiera se había enterado,TRUE
es,353,95.52,4.99,en euskera castellano y en inglés ese tiene que ser un objetivo básico de nuestra,TRUE
es,433,98,5.71,departamentos de educación y cultura y política lingüística asistencia técnica a través de la universidad pública,TRUE
es,128,100,3.97,para el aprendizaje de otras materias y se confirma además,TRUE
es,462,97.37,6.02,conforme a los criterios del vigente plan de euskera de osakidetza que por cierto también es,TRUE
es,433,100,10.34,para difundir una imagen positiva y proyectar el euskera en el exterior hemos adquirido compromisos específicos para favorecer la emancipación de la juventud,TRUE
es,463,98.9,5.08,así como la detección en el centro del alumnado con necesidades diversas en cuanto a procesos de aprendizaje,TRUE
es,290,100,5.19,nada positivo en incluir el lema únicamente en euskera les pedimos que,TRUE
es,6,100,4.8,más personas al aprendizaje por eso nos entra la sospecha,TRUE
es,88,100,9.76,a los debates de esta cámara en relación con el desarrollo del euskera y su implantación y pensamos nosotros que precisamente al revés que la señora ubera que ha sido un paso adelante,TRUE
es,553,100,10.1,es necesario que seamos conscientes de esa realidad porque en esos productos que tendremos que ofrecer es donde tendremos que integrar la visión del impulso del euskera y,TRUE
