language,speaker_id,PRR,length,sentence,keywords
es,462,100,7.15,vamos a apostar por la normalización progresiva del uso del euskera vamos a apostar por el respeto,TRUE
es,480,100,10.32,lortzea ari gara el tercer idioma como aquí se comentaba no tiene porque necesariamente ser el inglés consideramos que,TRUE
es,290,100,10.32,y de excesos una nueva vuelta de tuerca en las obsesiones lingüísticas del partido nacionalista vasco que perjudicará a decenas de trabajadores esto,TRUE
es,130,99.07,8.23,identitaria o lingüística y en indudable que la cultura también tiene una dimensión económica una dimensión de motivación humana,TRUE
es,290,100,5.89,lingüístico y por lo tanto el resto de grupos el resto de grupos lo que tenemos que hacer es defender,TRUE
es,275,100,9.97,es por el tema del idioma por el tema del euskera eso sí ahora e te be dos también está emitiendo en navarra y por qué,TRUE
es,189,100,5.59,positivo tener esa radiografía lingüística del conjunto de las lenguas,TRUE
es,355,100,8.3,cómo se imparte cada uno de los idiomas qué efectividad tiene si realmente estamos cumpliendo los parámetros mínimos para tener una educación de calidad de todo eso,TRUE
es,275,100,3.5,y es así se ganará en perfil de euskera,TRUE
es,505,100,9.57,su prioridad es atacar a los profesionales que pueden acreditar un perfil lingüístico entiendo que en este momento ustedes,TRUE
es,309,100,6.89,los perfiles lingüísticos a las plazas el perfil lingüístico es un requisito más,TRUE
es,189,100,7.92,que se le ha dado al euskera en esta oferta pública de empleo me dirá que está encantado me dirá que está encantado de,TRUE
es,463,100,8.13,en euskera y castellano y suficiente en la primera lengua extranjera hori guztia lortzeko helburuarekin,TRUE
es,420,100,8.05,adaptado a la complejidad social actual sin discriminaciones y teniendo en cuenta que nuestra lengua propia el euskera es,TRUE
es,380,99.19,7.82,firmaron hace dos legislaturas y a un acuerdo de colaboración con el gobierno vasco para la normalización del uso del euskera en el mundo de la empresa,TRUE
es,189,100,8.34,exactamente el partido socialista instaba al gobierno vasco a modificar la normativa correspondiente a la asignación de perfiles lingüísticos en cada puesto de trabajo,TRUE
es,290,99.17,9.73,sin nosotros yo creo que lo único que se busca con esta iniciativa por lo tanto es aumentar las ayudas a berria y al resto de medios editados en euskera,TRUE
es,497,99.04,6.93,como tampoco ningún ciudadano puede imponer a otro en qué idioma debe comunicarse aquí no cabe aplicar obligatoriedad alguna,TRUE
es,380,100,5.57,no andamos tan sobrados en euskadi de consensos básicos como para romper el del euskera,TRUE
es,474,89.29,7.02,creo que no se la ha leído y yo estoy de acuerdo en que en materia lingüística no puede haber discriminación,TRUE
es,467,100,8.14,práctica en centros de trabajo ambas líneas en ejecución en colaboración entre lanbide y el departamento de educación política lingüística y cultura,TRUE
es,149,100,3.98,de la lengua francesa y del euskera,TRUE
es,530,100,7.37,en resumen estoy convencida de que la línea de subvenciones a medios de comunicación en castellano para la publicación de noticias en euskera,TRUE
es,290,100,9.19,porque e i te be debe cumplir el compromiso adquirido a favor del euskera y de la cultura vasca hasta ahora no ha cumplido ese compromiso,TRUE
es,355,100,5.95,su historial académico y las características sociolingüísticas del entorno eso ya lo recoge,TRUE
es,128,100,9.81,la única comunidad autónoma que tiene competencia en becas y usted ha quitado las becas de idiomas de lenguas para,TRUE
es,466,100,5.86,pueden aprender un idioma el tercero en nuestro caso,TRUE
es,462,100,9.42,cuando quieran el castellano y normalizar el euskera como lengua de servicio y como lengua de trabajo en los diferentes ámbitos de su competencia,TRUE
es,463,100,8.86,para que el alumnado alcance una competencia avanzada en euskera y castellano y suficiente en un tercer idioma a finalizar la educación por tanto,TRUE
es,99,100,10.23,proyecto lingüístico defendemos un sistema plurilingüe para nuestra red educativa pero no estamos de acuerdo con cualquier sistema educativo presuntamente,TRUE
es,130,100,10.31,similitud con el gobierno de españa gasto superfluo departamentos ideológicos como el de igualdad y el de cultura y política lingüística administración sobredimensionada,TRUE
es,499,100,9.86,por parte del personal técnico de la dirección de promoción del euskera en esta fase se comprueba el cumplimiento de las condiciones para participar,TRUE
es,23,100,9.69,prefiero ser benevolente y quedarme con la idea que se trata de una cierta reflexión y aprendizaje de lo ocurrido por aquello de que reconocer errores del pasado o que rectificar es de sabios,TRUE
es,353,97.79,8.49,definir con claridad cuáles son las necesidades reales las necesidades lingüísticas reales en cada una de las plazas de e i te be eso es lo primero que tenemos que hacer,TRUE
es,290,98.89,6.81,porque se ha sentido claramente perjudicada y discriminada porque se le ha intentado imponer el uso del euskera,TRUE
es,355,100,10.01,en este campo en el que el objetivo principal es el empleo de las personas de los jóvenes el euskera es un objetivo importante pero no es el más importante yo,TRUE
es,131,100,9.71,abogamos porque se analice dentro del propio plan de plurilingüismo de la universidad sus competencias lingüísticas y la adquisición de esas competencias lingüísticas que nosotros décimos,TRUE
es,6,100,3.53,nos decía también la señora celaá que con el euskera no basta,TRUE
es,355,100,8.67,del consejero de cultura y política lingüística pero evidentemente afecta a educación porque es una parte fundamental del deporte escolar y del sistema educativo,TRUE
es,480,98.08,4.59,a la enseñanza del euskera en formato televisivo por supuesto,TRUE
es,128,98.11,3.72,el gran punto negro de la política lingüística que hemos aplicado,TRUE
es,417,100,5.84,me parece asimétrico incluso podría ser corruptela en su lenguaje entonces,TRUE
es,420,100,4.54,seguro que conseguiremos mejoras en euskera en matemática,TRUE
es,465,100,9.25,creo que lo he comentado en esta cámara una aplicación muy relevante en cuanto a traducción de castellano euskera euskera castellano basado en inteligencia artificial y que desde luego es,TRUE
es,189,92.86,5.01,y luego eligen destinos en los que la demanda del euskera es testimonial y luego tenemos mil cuatrocientos plazas,TRUE
es,488,100,10.09,generalizando que el desequilibrio entre las necesidades educativas y las ofertas de plaza también se va acentuando o por ejemplo la evolución de los modelos lingüísticos,TRUE
es,380,100,10.07,el consejo asesor del euskera establece como condición necesaria para el desarrollo del euskera la adhesión por parte de la ciudadanía porque por encima de todo,TRUE
es,466,100,10.26,ambas líneas están en ejecución por eso le digo que sí están en ejecución y son fruto de colaboración entre lanbide y el departamento de educación política lingüística y cultura,TRUE
es,497,100,3.93,de coincidencia con el día del euskera,TRUE
es,353,100,10.1,que hoy quieren que sus hijos terminen la etapa obligatoria con un conocimiento suficiente en las tres lenguas el euskera el castellano y el inglés y,TRUE
es,6,90.91,5.03,totalmente lo contrario que hay que seguir con los modelos lingüísticos por lo tanto no sé cómo,TRUE
es,174,88.41,4.92,fomente el euskera que fomente la cultura vasca y que satisfaga todos los principios,TRUE
es,275,100,10.18,en una de sus líneas estratégicas concretamente en la tres se proponía reforzar la audiencia en euskera de e i te be y para ello expresamente se dice que buscará activamente el encuentro,TRUE
es,540,100,9.93,el tema de los niveles retributivos y dos el nivel de euskera las dos únicas cosas que al parecer han preocupado hasta ahora que sepamos ojalá supiéramos más pero como no nos lo quieren decir no lo sabemos,TRUE
es,128,91.04,6.42,unos modelos flexibles territorios flexibles que incorporen el euskera,TRUE
es,128,100,9.49,presente o futura va a condenar el futuro del euskera de ninguna de las maneras en estos veinticinco o treinta años,TRUE
es,433,85.06,6.63,mique gros i lladós soziolinguistak honelaxe dio el euskera en el comunidad autónoma de euskadi,TRUE
es,353,85.22,6.83,de los que no saben euskera en su municipio ustedes dicen que aquí hay una campaña del delegado del gobierno esto es una vergüenza,TRUE
es,483,100,8,sin embargo somos conscientes de la existencia de casos que requieren un tratamiento más diferenciado incluyendo la exención del euskera en este sentido,TRUE
es,463,100,3.66,en distintos ámbitos en los que la normalización lingüística se refiere,TRUE
es,533,100,6.27,o no como lengua para la educación durante las últimas décadas el euskera ha sido impuesto,TRUE
es,530,100,10.39,es curioso y hasta sospechoso y me baso además en datos del pasado ejercicio en el país vasco subvencionar el uso del euskera es la gran medida destinar dinero público,TRUE
es,128,98.65,5.61,ese aprendizaje a lo largo de la vida con esta ley señorías queremos ayudar a dar respuesta,TRUE
es,130,100,9.25,en el ámbito de las actividades que se desarrollan en el primer sector al objeto sobre todo de clarificar cada uno de esos conceptos y que manejásemos todos el mismo lenguaje,TRUE
es,93,100,5.42,insisto no hagan pedagogía no un uso del euskera que no corresponde eskerrik asko,TRUE
es,128,98.48,5.58,el ce uno ni en euskera ni en inglés ni en parecidos porque el ce uno no es el examen,TRUE
es,483,100,9.81,la normativa vigente ya establece que aquellos estudiantes que se incorporen a cualquier colegio de euskadi procedentes de otros sistemas educativos estarán exentos de la evaluación del euskera,TRUE
es,290,100,5.59,del euskera que se hacía entonces y el que se hace ahora qué más quiere usted que se haga,TRUE
es,353,100,5.53,puedan alcanzar un conocimiento práctico del euskera suficiente e importante por qué no,TRUE
es,423,100,10.32,cómo es posible que la cadena que debe favorecer el euskera emita horas y horas seguidas de un programa mudo como kamara ezkutua continúe con conciertos de,TRUE
es,474,98.15,4.42,en euskera abertzale punto pelota y si quiere otro día cuando tenga,TRUE
es,88,100,7.37,y hemos debatido sobre exámenes cualitativos de perfiles lingüísticos la evaluación del plan de normalización,TRUE
es,466,100,9.78,diversos puestos en centros con ciclos formativos según los criterios del departamento de educación y hay también falta de conocimiento de euskera,TRUE
es,128,100,10.37,la política lingüística ha de ser democrática y por lo tanto opinable desde luego ni la imposición franquista hizo desaparecer el euskera,TRUE
es,242,100,10.36,los términos y el lenguaje como si fuese una piedra al oponente político eso es lo que usted buscaba y eso es lo que con nuestra ayuda no va a conseguir yo no sé si voy a tener un problema o no,TRUE
es,309,100,6.56,y otro medio millón entiende la lengua vasca la única oferta que tienen de televisión en euskera es la menos elegida,TRUE
es,99,100,10.23,práctico suficiente en las dos lenguas oficiales tanto en euskera como en castellano ustedes están siendo cómplices de la ruptura de estos dos principios acordados en este parlamento,TRUE
es,485,100,9.73,cómo va a garantizar el gobierno vasco que el euskera sea la lengua habitual entre alumnos y alumnas al terminar la enseñanza iguales iguales,TRUE
es,6,98.55,4.21,que puedan ser la base del nuevo consenso lingüístico que la educación vasca requiere,TRUE
es,134,100,8.52,en qué en qué medios de comunicación social en euskera al margen de etb,TRUE
es,531,100,10.19,y el más importante para la socialización del euskera por eso necesitamos defender este lugar público y compartido que es la escuela pública,TRUE
es,174,100,9.67,a la producción en euskera y que por tanto ese contrato programa sea aprobado por esta cámara y por lo tanto modulado en su caso,TRUE
es,483,100,5.7,dice usted que le parece mal que se valore más el euskera que otras formaciones,TRUE
es,380,100,9.67,pero que acoge asociados únicamente que escriban en euskera es una discriminación por motivos lingüísticos clara,TRUE
es,174,100,9.89,a la producción de euskera en etb que se canaliza efectivamente y básicamente a través de su primer canal hemos repetido también que decía,TRUE
es,353,86.05,3.79,el euskera relegado a tercera cuarta quinta por qué,TRUE
es,485,100,3.98,es un problema de utilizar el euskera de una forma,TRUE
es,128,87.88,3.76,no es el conocimiento lingüístico,TRUE
es,134,97.01,3.83,sí hay más dinero para otras cosas para el euskera y para otras cosas sí que hay dinero,TRUE
es,473,94.34,9.8,de especialización creo que eso tenía que haber pasado ya y simular incluso que el mérito de euskera hubiese sido más importante,TRUE
es,485,100,6.96,o un euskera no totalmente asimilado no llegarían al be dos me van a decir que no son euskaldunes,TRUE
es,189,95.59,3.79,en nivel suficiente si no estamos hablando de que no se tenga que exigir el euskera,TRUE
es,189,100,4.98,para cambiar una política lingüística y digo que tenía el soporte de dos acuerdos,TRUE
es,353,100,10.38,apostar así por un modelo trilingüe euskera inglés y castellano que nos permita avanzar en los próximos años con una política,TRUE
es,128,98.72,6.23,el aprendizaje del inglés impulsar la formación profesional dual que hacemos máxima calidad,TRUE
es,290,100,6.04,el señor isasi víctima por lo tanto de sí mismo y de sus obsesiones lingüísticas,TRUE
es,290,100,9.46,seguir avanzando en la implantación del inglés como lengua vehicular en aquellas materias educativas donde el inglés es el idioma principal o prioritario,TRUE
es,380,100,7.37,a aquellos medios que son diarios y que publican íntegramente en euskera y que además,TRUE
es,413,98.39,5.56,pero dele la oportunidad para que en libertad hablen el idioma que le dé la gana,TRUE
es,479,100,6.51,la rioja todavía no se había metido pero supongo que ahora podemos empezar a hablar también de eso no sé si es el ámbito donde se habla el euskera,TRUE
es,99,100,7.77,no no no sus hijos no estaban exentos de estudiar euskera estaban exentos de ser evaluados de la lengua,TRUE
es,530,100,7.36,y le voy a decir por qué porque se está perdiendo y desdibujando porque hay muchas personas que ya hablan de idioma idiomo idiome,TRUE
es,290,100,10.24,a veces por motivos lingüísticos otras veces discriminaciones por motivos ideológicos y siempre discriminaciones por motivos sectarios por eso,TRUE
es,124,100,7.36,en otro lugar del mundo pues euskal herria precisamente su cultura su idioma su historia sus tradiciones y eso es lo que debe ser,TRUE
es,310,100,10.36,señor oyarzabal cuando dice que los nacionalistas instrumentalizan el euskera si usted a la palabra nacionalistas añade,TRUE
es,494,100,10.39,que afecta al conocimiento del euskera al problema que hablaban en concreto en la parte dispositiva de su proposición no de ley,TRUE
es,290,100,6.52,a día de hoy por qué no se reflexiona sobre la política lingüística que nos cuesta ciento quince millónes de euros anuales,TRUE
es,355,100,5.94,o la escuela pública vasca o la normalización del euskera o el derecho a una renta de garantía de ingresos,TRUE
es,189,100,10.23,llevar una conversación en euskera eso es ser equilibrado eso es fomentar el euskera es decir por exigir,TRUE
es,353,100,6.66,ha presentado una enmienda de totalidad diciendo que el euskera esté presente en el mapa de la radio como si no estuviese ya,TRUE
es,355,91.82,7.87,mientras que es cierto y eso es cierto que el modelo quinientos de enseñanza en euskera se encuentra ahora ante un nuevo desafío el último,TRUE
es,353,100,9.92,el euskera y pronto cuando tengamos la oportunidad de tener un profesorado capacitado para enseñar en inglés el euskera el castellano y el inglés,TRUE
es,290,100,10.39,la lengua tiene por lo tanto una serie de objetivos y para alcanzar esos objetivos plantean una serie de acciones esto es importante la agenda estratégica del euskera,TRUE
es,290,100,6.61,en contra de los derechos lingüísticos de personas que querían expresarse en euskera,TRUE
es,505,100,10.07,dicen que es una exigencia desproporcionada del euskera en relación con otros méritos y no es así es ajustada a la legalidad a la legalidad de la que nos hemos dotado en este parlamento entre ellas la ley la,TRUE
es,353,100,8.28,el euskera tenga una mayor relevancia que sea determinante en esa actividad que rodea a los niños en esa etapa pero desde luego que no se,TRUE
es,88,100,10.15,mi grupo durante muchos años ha pretendido en esta cámara racionalizar y reorientar lo relativo a la implantación y gestión de los perfiles lingüísticos pero señor maneiro,TRUE
es,290,100,7.42,sobre la materia reconoció que el análisis cualitativo de idoneidad de los perfiles lingüísticos no se había producido todavía,TRUE
es,463,96.12,7.62,la duración idónea de las sesiones de evaluación y el funcionamiento de los ítems adecuado para medir lo que se pretende así como su adecuación lingüística,TRUE
es,407,100,4.26,especifique en un lenguaje claro todas las condiciones,TRUE
es,310,100,5.56,o al consejo escolar de los centros privados concertados la aprobación del proyecto lingüístico del centro,TRUE
es,99,100,10.19,kontu batean behintzat bat datozela visto lo visto parece que lo que persigue más de un grupo es la superación del sistema de modelos lingüísticos que nos han permitido y dado garantías,TRUE
es,105,98.29,9.31,otras los consejeros y consejeras también tomaron su cargo de diferente manera algunos en euskera otro en erdera y otros en los dos idiomas,TRUE
es,275,100,9.76,antagonismo entre el euskera y el castellano ya que para este grupo parlamentario ambas son nuestras lenguas y son y deben ser instrumentos lingüísticos complementarios,TRUE
es,128,100,10,sino por toda la legislación vigente en el país vasco tiene el euskera puesto de honor y en todos los centros educativos se le da,TRUE
es,290,100,5.87,por imponer el euskera al conjunto de la sociedad por parte de los partidos nacionalistas,TRUE
es,370,100,10.14,en el lenguaje de la equidistancia y lo que estamos consiguiendo es que nuevamente,TRUE
es,290,100,10.21,económicos de su organización es la policía lingüística al servicio de las obsesiones del nacionalismo vasco ciertamente,TRUE
es,290,100,5.89,cómo se resume la acción del gobierno durante todo este tiempo palabrería neolenguaje,TRUE
es,353,98.88,9.21,porque se establece por la que se establece a través de este plan perfiles de euskera obligatorios que imponen,TRUE
es,290,100,8.69,a este cuarto punto se trata de que para puestos que no tienen perfil lingüístico asignado para aquellos cuya fecha de preceptividad no está vencida,TRUE
es,465,100,10.31,arrazoi batzuk y formulo lo mismo que acabo de decir en euskera en castellano claramente este gobierno quiere reiterar,TRUE
es,463,99.13,6.99,porque las personas que tienen delante entienden euskera y se producirán situaciones en las que se darán estas conversaciones asimétricas,TRUE
es,275,100,4.01,que saber euskera porque además usted,TRUE
es,290,100,9.77,que nosotros consideramos políticamente inaceptables como la inclusión de criterios lingüísticos o incluso claramente ilegales como la propuesta de no realizar contratos,TRUE
es,353,96.72,4.39,en la mayoría de las áreas del conocimiento y del desarrollo el aprendizaje,TRUE
es,290,100,10.39,una pequeña parte de la población lo conocía y por lo tanto se utilizó el hecho de que el euskera fuera lengua oficial para esas vueltas de tuerca e imponer,TRUE
es,353,100,10.3,la voluntad y el esfuerzo de la inmensa mayoría de la sociedad vasca que ha estado que está con el euskera que ha hecho un esfuerzo compartido,TRUE
es,0,93.02,7.71,critique al euskera y que la señora ubera se vea obligada a salir a tribuna ubera andrea zure txanda izango,TRUE
es,483,100,10.15,espacios educativos adaptados para las necesidades del alumnado en euskera asegurar la gratuidad del estudio de euskera hasta conseguir,TRUE
es,355,100,8.15,de modelo lingüístico otra cosa es que de forma natural las familias vascas se han ido inclinando progresivamente,TRUE
es,275,100,4.47,o más bien en euskera txapelduna da porque creo que estamos,TRUE
es,290,100,9.96,porque quise una decisión personal de hecho todavía sigo estudiándolo y hablo en euskera cuando considero necesario cuando creo que tengo que hablarlo,TRUE
es,290,100,8.49,imperdonable y porque digan lo que digan los manipuladores del lenguaje la custodia compartida es una medida,TRUE
es,189,98.25,4.57,es un avance que la gente que muchos ciudadanos vayan a aprender euskera,TRUE
es,353,100,9.96,lo que siempre hemos defendido aquí no hubiesemos firmado la enmienda que presentó el partido nacionalista vasco donde hablaba de que el euskera,TRUE
es,189,100,10.35,al departamento de sanidad a realizar esa valoración adecuada del conocimiento del euskera como mérito en las futuras ope de forma que se buscara ese equilibrio,TRUE
es,469,100,5.06,en materia de medioambiente en lo que respecta a los derechos lingüísticos,TRUE
es,530,100,4.94,y si entienden que su idioma es el español será porque no ven posibilidad de negocio en euskera,TRUE
es,530,100,10.14,un planteamiento que mantienen vigente en la actualidad después de años de promoción de modelos educativos solo en euskera de desmesuradas exigencias de perfiles lingüísticos,TRUE
es,509,100,7.78,con una óptima capacidad de comprensión del euskera pero con habilidades productivas limitadas integrados en contextos,TRUE
es,355,100,9.94,tratamiento fundamentalmente en relación con el tratamiento integrado e integral de las lenguas promoviendo un plan de formación lingüística y de metodología del profesorado,TRUE
es,309,100,10.39,por parte del departamento de cultura con respecto a los perfiles lingüísticos en la administración y el sector público lo que no se puede hacer es fijar objetivos inalcanzables,TRUE
es,290,100,10.3,de imposición lingüística nosotros defendemos políticas para el fomento del euskera obviamente otra cosa es que los recursos que se destinan para ello,TRUE
es,353,86.74,10.02,en el caso de uso exclusivo del euskera para la difusión de la actividad cien por ciento de la subvención oiga pero esto no obstante ustedes están de choteo o qué se están ustedes cachondeando de esta sociedad de este país,TRUE
es,517,100,10.4,como elemento de igualdad integración y fomento del euskera a estas alturas todas y todos somos conscientes de que el coronavirus afecta a cada ámbito de nuestra vida,TRUE
es,505,98.75,4.92,con la que está cayendo en estos momentos de crisis es su prioridad es atacar al euskera al euskera,TRUE
es,290,100,10.33,tiene derecho a hablar en el idioma que considere pero en el ámbito privado no puede obligar a que se le responda en ese mismo idioma tan sencillo como esto,TRUE
es,488,98.23,9.15,lingüístico es decir discriminación positiva discriminación positiva necesitamos dar más a los que menos tienen para que alcancen los,TRUE
es,353,97.01,6.17,trata de esconder que es incapaz hacer avanzar el euskera en gipuzkoa sí ustedes,TRUE
es,290,100,10.19,lingüísticos para determinados puestos de trabajo donde esos perfiles lingüísticos no son en absoluto necesarios para realizar perfectamente,TRUE
es,189,100,8.5,en la campaña electoral y que planteaban claramente la modificación de la política lingüística son los mismos dos párrafos que hoy plantea el partido popular,TRUE
es,490,100,9.19,veintiuno operaciones cultura y política lingüística quince empleo y políticas sociales doce salud doce operaciones también,TRUE
es,353,100,8.72,las necesidades lingüísticas de cada puesto de trabajo que es una exigencia previa que tiene que hacer el departamento,TRUE
es,483,100,3.78,exigen de ser atendidos en lo que es su idioma,TRUE
es,353,100,6.1,del conocimiento obligatorio del euskera en los pliegos de contratación de las administraciones no estamos hablando,TRUE
es,290,100,10.16,recursos y no analizar los resultados obtenidos para ustedes eso es respeto en fin que ustedes hablen de respeto solamente en este asunto lingüístico,TRUE
es,353,100,3.77,a firmar con estos nada en materia lingüística,TRUE
es,530,100,9.51,consejeros señorías desde hace décadas es ingente la cantidad de dinero público gastado en promoción del uso del euskera millones de euros que han hecho posible,TRUE
es,128,100,10.39,fueron espectaculares el avance en el conocimiento del inglés era extraordinario mientras que el euskera el castellano y las materias impartidas en inglés,TRUE
es,473,100,9,luego también los derechos lingüísticos toda política lingüística en nuestro caso en euskadi tiene que tener presente que si quiere conseguir,TRUE
es,474,97.01,4.25,los peticionarios de modelo a tienen un perfil lingüístico digamos heterogéneo,TRUE
es,370,100,8.88,se lo digo porque me sorprende el criterio por el que su gobierno destina trescientos treinta y cinco millónes de euros a la agenda estratégica del euskera,TRUE
es,535,100,10.26,para promover cambios sociales entendemos que toda persona tiene derecho a comunicarse relacionarse y ser atendida en la administración en cualquiera de los dos idiomas oficiales,TRUE
es,463,100,7.27,hemos presentado en la comisión de cultura política lingüística juventud y deporte el plan de acción para la promoción del euskera,TRUE
es,290,100,6.72,el actual sistema de modelos lingüísticos que la propuesta lingüística requerida por la educación vasca debe ser,TRUE
es,189,100,5.79,y por otra parte pedimos también una revisión de la puntuación del euskera en relación,TRUE
