language,speaker_id,PRR,length,sentence,keywords
es,189,100,8.37,que no pueden elegir acceder o no pueden anhelar acceder a un empleo público porque simplemente el euskera se exige de forma excesiva en relación,TRUE
es,505,100,9.43,no desprestigie el euskera y a los que tenemos como usted dice la suerte de saberlo y poder utilizarlo eta,TRUE
es,189,100,9.38,o de un master pues lleve a que las personas que puedan acreditar ese nivel de euskera se les dé esos dieciocho puntos pasan a los primeros puestos de la lista,TRUE
es,275,95,3.75,y la propaganda hay que hacerla en euskera y en castellano no vaya a ser que los,TRUE
es,433,100,8.29,euskadi es un ejemplo de normalización lingüística y euskadi es un ejemplo de protección social por lo tanto,TRUE
es,128,100,5.37,y científica tomar las decisiones oportunas que nos permitieron avanzar en el euskera,TRUE
es,290,100,4.79,de elección lingüística en lengua materna sobre este asunto,TRUE
es,309,100,10.35,está previsto para este primer cuatrimestre del año tiene que venir a la cámara también el estudio de idoneidad de los perfiles lingüísticos que yo creo que ese es una aspecto clave,TRUE
es,413,100,4.89,esta ley aprendizaje permanente e innovación tecnológica,TRUE
es,290,98.46,6.5,lo que no se tiene es el derecho a imponer a la otra parte que hable también en euskera,TRUE
es,104,100,10.3,adecuándose a la diversidad sociolingüística que existe en euskadi y daría margen a las familias para optar por uno u otro modelo debemos fijar en todo caso,TRUE
es,355,100,7.17,no comparto la desconfianza de la señora ubera hacia que el inglés pueda ser una especie de amenaza para el euskera no es cierto es todo lo contrario,TRUE
es,290,100,9.89,un nivel alto de inglés lo que implicaría evidentemente liberalizaciones y contratar sustitutos que ya sepan inglés en fin lo mismo que se ha hecho con el euskera,TRUE
es,510,80,3.59,que hoy en día no utilizaríamos seguramente un lenguaje tan florido,TRUE
es,473,100,9.81,la opción lingüística yo creo que es precisamente al contrario no hay normalización sin democracia y democracia quiere decir que hay que respetar todos los derechos,TRUE
es,290,98,3.86,el plan de euskera dos mil trece dos mil dieciséis si el grupo,TRUE
es,473,95.77,4.73,que la parte de la población castellanohablante se interese por el euskara y la haga suya,TRUE
es,290,100,10.3,evidentemente pero de ahí a exigirles además que tienen que tener como una de sus labores el impulso o el fomento del euskera no esto ya digamos que es voluntario,TRUE
es,128,100,6.38,y si la política lingüística en el país vasco ha podido avanzar y no así en otros muchos sitios es porque ciertamente,TRUE
es,290,100,7.39,empobrecimiento de la lengua vasca cuál es el nivel verdadero real que se habla de euskera,TRUE
es,340,84.48,4.37,repáseselos repásese las intervenciones modere un poco el lenguaje,TRUE
es,416,98.44,4.26,por su parte belarri prest son quienes entendiendo el euskera invitan al resto,TRUE
es,490,100,9.42,por importe de setenta millónes de euros el departamento de cultura política lingüística crece hasta los trescientos veintidós coma cuatro millónes de euros,TRUE
es,353,98.46,5.02,y ponen al euskera en la picota al servicio siempre de su estrategia política,TRUE
es,353,98.7,5.72,que esa apuesta garantizase el respeto a la libertad de elección lingüística de las familias,TRUE
es,526,100,8.84,estábamos hablando como ya le han dicho de cómo fomentar el euskera bien en etb y bien por medio de e i te be por lo tanto le digo lo mismo que le digo,TRUE
es,353,100,9.65,les garantice una capacitación lingüística en euskera en castellano y también en inglés esa es una demanda de las familias que se viene además detectando,TRUE
es,499,100,9.15,con respecto al departamento de cultura y política lingüística el acuerdo que usted menciona el del dos mil dieciocho que no el del dos mil diecinueve,TRUE
es,290,100,9.15,en relación al cumplimiento de los objetivos y desde luego nos parece que es una absoluta barbaridad el dinero que se ha destinado al euskera durante los últimos treinta años porque,TRUE
es,530,99.24,8.85,intervino el señor gordillo y la presidenta se dirigió a él en euskera cuando él no entendía el euskera no es excluyente el euskera en esta cámara claro que lo es,TRUE
es,353,100,9.55,un sistema que no tenga miedo a la evaluación un sistema en la que se fije la señalización del aprendizaje en las diferentes etapas,TRUE
es,353,100,9.05,de instrumentalizar el euskera mi primera propuesta sería que ustedes dejen de manosear la lengua nuestra lengua que es la de todos que dejen de utilizarla como un trasto,TRUE
es,370,100,9.02,es en una manipulación absoluta del lenguaje y termino señora presidenta diciendo que el partido popular vasco,TRUE
es,533,100,6.09,y espero que así sea respecto al tema de la obligatoriedad del euskera fue bastante menos claro,TRUE
es,479,96.51,5.02,donde desciende el nivel de euskera en las aulas y ya suspende uno de cada tres alumnos a mí me ha resultado,TRUE
es,488,95.24,10.26,ordena esaten duen bezala cuando para un determinado nivel y modelo lingüístico el número de solicitudes sea mayor que el número de plazas el órgano encargado es el que debe proceder a la baremación de las solicitudes de acuerdo,TRUE
es,6,96.05,5.71,ustedes quieren plantear el inglés como el enemigo del euskera y esto no puede ser admisible,TRUE
es,413,100,10.32,todavía hay muchos vascos que siguen usando el doble lenguaje que sirve lo mismo para un roto que para un descosido todavía hay muchos vascos apologistas de la lucha,TRUE
es,353,100,4.23,la realidad sociolingüística preexistente les da lo mismo,TRUE
es,533,96.43,3.96,o los quinientos cincuenta y cuatro millónes que llevamos gastados en cuatro años en impulsar el euskera,TRUE
es,497,100,9.53,y nosotros le décimos que no nosotros estamos diciendo que hay que garantizar el uso del euskera que todos los ciudadanos y ciudadanas de este país tienen derecho a dirigirse a la administración,TRUE
es,553,99.23,8.82,la razón de cierta frustración política y confusión social asumamos que a cada uno de estos objetivos es decir el de garantizar los derechos lingüísticos y el,TRUE
es,489,100,6.02,no contiene perspectiva de género utiliza el lenguaje que está ampliamente superado y que lo ha reconocido hasta emakunde,TRUE
es,353,97.37,4.51,ni vive por el euskera ni trabaja por el euskera el euskera se lo pasan por el arco del triunfo,TRUE
es,533,96.39,5.57,por todos esos niños que sienten el euskera como una tortura que dificulta su aprendizaje que hay de todo,TRUE
es,463,100,3.96,continúa estando en lo que se considera un nivel inicial de euskera,TRUE
es,290,100,10.3,premian a los de su cuerda y tratan de laminar a los que piensan de otro modo o a los que no utilizan el euskera o a los que no piensan como ustedes esto es el,TRUE
es,189,98.73,5.01,por simplemente no acreditar un determinado nivel de euskera o no saber euskera yo los conozco,TRUE
es,57,92.54,4.31,no es euskadi quien decide en qué idioma se hacen los exámenes pisa es el propio,TRUE
es,48,96,3.71,y en esto el lenguaje no es neutro señores puesto que ustedes,TRUE
es,530,100,9.08,y que padecen los rigores de la crisis generalizada del periodismo tradicional porque lo que parece evidente es que el impacto de estas ayudas en el uso del euskera,TRUE
es,380,100,3.49,porque las multas no tienen nada que ver con la realidad sociolingüística,TRUE
es,290,100,4.72,a mantener una política lingüística no discriminadora exenta de abusos,TRUE
es,88,100,10.32,se plantearon la cantidad de actuaciones que había en relación con el desarrollo de la normativa vigente en relación con el uso del euskera y,TRUE
es,499,100,7.63,presidente andrea martínez andrea es función y obligación del departamento de cultura y política lingüística,TRUE
es,275,100,8.98,con relación al euskera y eitb pues ese punto tres precisamente se refiere también a esa promoción en eitb del euskera luego,TRUE
es,485,94.44,8.12,porque si quieren que se acabe el euskera díganlo díganlo y yo miraba dentro de mí y decía nuestro grupo no quiere que se acabe el euskera,TRUE
es,54,98.11,4.18,evitando y denunciando el uso de un lenguaje racista y xenófobo,TRUE
es,490,100,5.9,relativos a las políticas de promoción y planificación del euskera como para el fondo de servicios sociales,TRUE
es,433,100,9.31,política lingüística y cultura y yo mismo lo estamos trabajando y lo tenemos muy presente a la hora de plantear la negociación primero insisto,TRUE
es,88,100,7.94,esas quejas no existen no aparecen hay quejas relacionadas con la atención oral por no atender en euskera especialmente por teléfono,TRUE
es,6,98.85,5.39,que tengan la misma competencia es lo que dice la ley que tenga la misma competencia en euskera y en castellano,TRUE
es,472,98.65,5.76,de las cuestiones planteadas en euskera frente al castellano por los ciudadanos nada más,TRUE
es,485,100,5.32,todo lo que hemos normativizado hasta ahora en euskera queda borrado,TRUE
es,485,100,8.35,que el euskera no sea una lengua para hacernos entender en el conjunto de europa no es descredito ni demerito,TRUE
es,380,100,5.58,no significa pedir que se retire todo lo que durante años se ha hecho en el euskera,TRUE
es,489,100,9.53,en la primera se exige acreditar un nivel mínimo de idioma y en la segunda consta de veinticinco preguntas de respuesta cerrada de las que se deberá contestar correctamente un mínimo de quince,TRUE
es,275,97.67,5.47,nuestra radio y nuestra televisión pública deben de cumplir esa misión de impulsar el uso del euskera,TRUE
es,380,100,10.11,está el apoyo de todo lo que estamos hablando hoy de todo lo que se ha desarrollado el euskera ahí no en movimientos que tienen importancia,TRUE
es,472,98.89,5.19,están planteadas en euskara el noventa y nueve por ciento en castellano esa es la realidad sociolingüística,TRUE
es,189,99.22,8.13,se llega a la disfunción en el sistema que al final los que precisamente se valen del euskera para obtener una buena puntuación luego eligen destinos en los que,TRUE
es,99,100,9.41,se insta al gobierno a analizar las modificaciones de las relaciones de puestos de trabajo que sean necesarias para adaptar progresivamente los requisitos lingüísticos de los puestos de trabajo,TRUE
es,413,98.31,4.34,del euskera y el castellano no hay dudas pedagógicas sobre esta materia,TRUE
es,530,99.22,8.18,y de otros medios de comunicación en euskera es una línea de subvenciones que debería desaparecer de los presupuestos porque las pagamos todos los vascos,TRUE
es,290,100,6.54,iniciativa contra el talibanismo lingüístico contra las políticas de imposición lingüística y a favor,TRUE
es,309,98.85,5.2,la misma valoración no tiene que tener el mismo perfil lingüístico ni los exámenes tiene que ser iguales,TRUE
es,550,100,10.2,en áreas que van desde la igualdad el euskera la protección de datos de carácter personal o incluso la ciberseguridad finalmente,TRUE
es,189,100,10.34,por un lado pedimos la revisión del euskera de la valoración de la puntuación que se le otorga al euskera a la hora de asignar los perfiles lingüísticos de cada plaza,TRUE
es,380,100,7.58,el progreso lingüístico y de convivencia en esta sociedad desde el ochenta y dos es lo que están haciendo por lo tanto,TRUE
es,309,100,10.24,y nace con el objetivo no declarado de intentar justificar un mandato basado solo en unos fines lingüísticos porque el resto de los objetivos no los van a cumplir ustedes,TRUE
es,483,100,9.64,allá por el congreso que ya está bien de catalán que ya está bien de euskera que ya está bien de concierto económico autogobierno y cosas que no son nada liberales y nada de bien,TRUE
es,309,100,5.47,los perfiles lingüísticos y por lo tanto esto hay que verlo en un contexto,TRUE
es,205,100,10.4,como siempre se ha cogido a los mejores profesionales con altas notas en las fases de oposición y si además tienen experiencia y además saben euskera,TRUE
es,530,100,5.39,que también en casos determinados es el euskera pero que en el país vasco sigue siendo mayoritariamente el español,TRUE
es,6,99.01,7.08,atenta contra nuestros derechos lingüísticos no garantizando su conocimiento ni uso y pone el camino a su desaparición,TRUE
es,305,96.61,4.87,para incrementar las partidas de ayuda al euskera para poder llegar así,TRUE
es,462,97.37,4.93,candidatos disponibles con perfil lingüístico acreditado para cubrir sustituciones,TRUE
es,88,100,6.33,se adecuará en cuanto a los niveles de competencia lingüística en euskera exigibles y a la valoración que hubiera de otorgarse,TRUE
es,189,96,4.01,por no hablar de las disfunciones los profesionales se valen del euskera para sacar puntos,TRUE
es,480,100,10.2,estos nos deben de llevar a reflexionar sobre la posibilidad o la pertinencia de efectuar cambios en los modelos lingüísticos de la enseñanza obligatoria,TRUE
es,290,100,10.09,vasco diseñar al parecer un nuevo sistema para aumentar el peso del euskera en el modelo a y como consecuencia de que no nos,TRUE
es,353,100,10.18,no soportan hablar de apuestas de futuro en el sistema educativo que tenga que ver con las cuestiones lingüísticas y con las apuestas que está haciendo hoy todo nuestro entorno,TRUE
es,463,96.49,5.67,nosotros tenemos primero que garantizar el euskera y el castellano,TRUE
es,290,100,8.47,todo esto se mantienen asignaciones presupuestarias para el fomento del euskera en el sur de francia el fondo de innovación,TRUE
es,533,100,8.78,y cuál es la realidad sociolingüística pues según datos del propio gobierno vasco encuesta sociológica realizada por el observatorio vasco de la juventud del gobierno vasco,TRUE
es,463,100,6.93,este departamento de educación política lingüística y cultura consideró oportuno continuar con las acciones previstas para este curso,TRUE
es,433,100,9.92,es ahora la educación el aprendizaje y la investigación reitero que hemos garantizado unos servicios públicos de calidad,TRUE
es,499,98.7,6.1,la ley del euskera de mil novecientos ochenta y dos que dedica varios artículos a esta cuestión,TRUE
es,238,100,6,a la euskaldunización el desplome de resultados de calidad de capacitación no solo lingüística,TRUE
es,367,100,8.65,por nadie en su formación política esto es su doble moral su doble lenguaje su doble ética,TRUE
es,496,100,4.05,informativos en euskera a emitir por ambos canales de etb,TRUE
es,290,100,10.02,administrativas curriculares y lingüísticas se trata de un sistema que posterga la formación profesional como alternativa prestigiosa hasta aquí,TRUE
es,343,100,5.78,para el suministro de comidas a centros públicos dependientes del departamento de educación política lingüística y cultura,TRUE
es,485,100,9.97,requisitos mucho más profundos que esa mera capacidad auxiliar son personas que tienen que hablar lenguaje de sordos son personas,TRUE
es,353,100,9.92,ese proyecto educativo el de las escuelas infantiles del consorcio haurreskolak recoge en lo relativo al tratamiento lingüístico que,TRUE
es,189,92.47,5.65,el partido popular sistemáticamente todas las legislaturas porque la política lingüística no cambia,TRUE
es,310,98.48,8.63,su abuelo opinaba que no se enseñara el euskera entre apuntes y tal algo así ha dicho,TRUE
es,6,98.65,6.39,euskera e inglés y ustedes por eso decía yo anteriormente la pregunta es cómo conseguimos,TRUE
es,6,100,10.36,horaria actual tendría que reformularse qué quieren decir estas afirmaciones que va a seguir manteniendo los tres modelos lingüísticos este gobierno,TRUE
es,290,100,10.02,por eso pensamos que no es asumible ningún tipo de privatización del ente porque hay que garantizar la emisión en euskera pero la pregunta es qué hacemos,TRUE
es,290,100,7.12,estos perfiles lingüísticos tienen que adecuarse realmente a lo que cada puesto de trabajo necesita,TRUE
es,128,100,10.19,precisamente se necesitan profesores de refuerzo lingüístico para esto se necesitan dinamizadores culturales para esto se necesitan proyectos globales de centro etcétera pero la,TRUE
es,530,100,10.2,décadas arrastrando un problema que además pasa por la gran mentira de los modelos lingüísticos y por la deriva totalitaria y francamente perniciosa de exigir el pe ele dos,TRUE
es,88,98.65,9.09,la transacción dice que el parlamento vasco insta al departamento de cultura y política lingüística que en el plazo de seis meses analice y envíe al parlamento vasco una propuesta,TRUE
es,544,92.22,5.7,por impulsar el conocimiento y el uso del euskera esta sigue estando en una situación de gran vulnerabilidad,TRUE
es,423,100,6.66,esto es por la calidad que se ofrece en euskera o por la falta de calidad que se ofrece en euskera pero esto no acaba aquí,TRUE
es,290,100,5.58,entienden esto ustedes o no lo entienden una cosa es defender el fomento del euskera,TRUE
es,128,100,5.57,pero qué tiene que ver decían puede haber personas que hablen perfectamente y desarrolle su vida en euskera,TRUE
es,353,100,8.29,cada uno de los cinco puntos en relación con la competencia lingüística asumir la responsabilidad de como fija la ley,TRUE
es,113,96.43,6.57,mil novecientos veinticinco se retiran los libros de texto en euskera y suspensión de empleo y sueldo a quienes enseñen en esa lengua,TRUE
es,290,100,7.31,en los últimos tiempos se han aplicado políticas lingüísticas de imposición y se han cometido abusos para imponer,TRUE
es,509,100,6.34,creemos en que una opción podría ser un modelo lingüístico trilingüe con el euskera como eje vertebrador,TRUE
es,353,100,4.15,ocho punto dos de la ley de normalización del euskera y lo dice,TRUE
es,507,100,8.79,y lo decía en euskera y costaba entenderlo pero lo digo en castellano para que no se me quede con la sensación de no haberlo dicho el consejo regulador ataca,TRUE
es,6,100,6.19,quieren acabar con todo aquello que sea distinto al castellano no podemos permitir este acoso y derribo al euskera,TRUE
es,485,98.78,6.2,pues hay mucha gente que habla normalmente en euskera yo me estoy acordando de mi suegra que cuando decía,TRUE
es,488,100,4.45,más cercana en nuestro propio territorio común del euskera y también,TRUE
es,290,100,9.76,racionalidad en todo lo que tiene que ver con el euskera pero en general con la política vamos a ver la publicidad institucional no está ni para subvencionar,TRUE
es,189,97.67,3.8,sí pueda haber una demanda del uso del euskera como en,TRUE
es,6,96.61,5.11,tendrá como eje el euskera con el fin de superar el desequilibrio actual,TRUE
es,290,100,7.01,diversas cuestiones que yo quiero poner encima de la mesa cómo favorecemos la extensión del uso del euskera,TRUE
es,189,100,6.5,una revisión de las exigencias del euskera que el idioma no puede ser un elemento de discriminación en el acceso a la administración,TRUE
es,309,100,8.2,usted repite en su proposición no de ley la idea del innecesario conocimiento del euskera lo ha repetido en algunos párrafos,TRUE
es,310,100,9.87,bastantes argumentos de peso por los que queda totalmente clara la legalidad de la actuación municipal al redactar las actas en euskera la publicidad,TRUE
es,353,100,10.2,a llevar a sus hijos a estudiar fuera de nuestra comunidad ante la falta de respuesta de la administración y nosotros venimos aquí no con un grave problema no a modificar la política lingüística,TRUE
es,429,100,4.09,con exigencias naturales y lógicas en relación al euskera,TRUE
es,290,100,9.76,la propuesta de exigir determinadas condiciones lingüísticas a las empresas que pretendieran acceder a subvenciones de la administración vasca en su tramitación parlamentaria,TRUE
es,290,100,10.25,recibíamos respuesta de este gobierno a una serie de preguntas realizadas por este grupo la consejera de educación política lingüística y cultura nos respondió de manera excesivamente,TRUE
es,275,100,10.18,cómo lo van a condenar si ustedes lo consideran justos siguen utilizando ese lenguaje mentiroso que tanto les gusta siguen hablando de,TRUE
es,488,95.83,9.38,utilizar ese lenguaje era el tema de las sanciones estábamos apostando justo por la voluntariedad que se premiase a quien lo hiciera bien es decir,TRUE
es,88,98.72,5.48,en materia de idiomas en materia de muchas cosas en relación con lo que tiene que ser una necesidad,TRUE
es,499,100,4.67,garantizar la presencia del euskera en esa realidad eskerrik asko,TRUE
es,130,100,6.8,los socialistas vascos defendemos la normalización del euskera en todos los ámbitos también en el turístico,TRUE
es,380,100,10.34,no hay otra razón para hacer esto discriminación entre escritores vascos por motivos lingüísticos la cuestión es si,TRUE
es,380,100,4.27,del euskera eso no cuesta dinero es verdad que hay que ver,TRUE
es,530,100,9.75,son solo papel mojado la proposición de ley que ha traído a esta cámara eh bildu busca abundar en el derecho de la población vasca para estudiar y comprender el euskera,TRUE
es,128,100,10.27,como para los euskaldunes tanto para aquellas zonas sociolingüísticas que no tienen el euskera como para una comunidad en la que ciertamente casi el ochenta por ciento,TRUE
es,88,100,6.96,la feria de durango en el siglo veintiuno debe de acomodarse a una actuación integral sobre la cultura vasca en un idioma u otro,TRUE
es,355,100,5.38,y no se solicita el euskera como lengua principal para la actividad profesional porque se prioriza,TRUE
es,290,100,9.98,realmente necesarios únicamente en aquellos puestos de trabajo donde esos conocimientos lingüísticos sean estrictamente necesarios para realizar correctamente la labor que exige el puesto,TRUE
es,463,100,9.26,con el objetivo de que el alumnado alcance con carácter general una competencia comunicativa avanzada en euskera y castellano y suficiente en inglés al finalizar la educación obligatoria,TRUE
es,462,100,9.5,el primer año de la legislatura antes de finalizar el primer año aprobamos el segundo plan de normalización del uso del euskera lo tomamos como una de las primeras tareas,TRUE
es,6,94.29,5.04,disposición adicional treinta y nueve punto uno ahora del euskera sabe que dice bueno,TRUE
es,420,100,3.46,la riqueza de las distintas modalidades lingüísticas de españa,TRUE
es,189,100,10.4,obviamente como un gobierno nacionalista y que quiere imponer el euskera y que tiene la política lingüística de imposición que tiene al margen de la realidad sociolingüística y de la propia realidad,TRUE
es,290,100,7.2,destinando millónes de euros al fomento del euskera y aplicando políticas de imposición lingüística creo que,TRUE
es,355,100,4.46,euskera y castellano porque los dos son idiomas oficiales,TRUE
es,275,100,5.55,alejados desproporcionados y desajustados a las realidades sociolingüísticas existentes,TRUE
es,290,96.59,5.89,prácticamente para todo lo demás es indispensable saber euskera sobre todo en lo que se refiere al acceso,TRUE
es,290,100,4.69,necesita de los conocimientos del euskera este es en resumen,TRUE
es,355,100,10.33,deben usarse como herramientas del proceso de aprendizaje como materia y como medio de transmisión al mismo tiempo todos los alumnos tienen que tener acceso a todas las lenguas,TRUE
es,533,100,7.96,consagrado a la misión nacionalista de imponer el euskera a todos a machamartillo y que lo que está provocando es que hoy el euskera,TRUE
es,483,100,10.32,sin duda alguna es responsabilidad de todos y todas las aquí presentes mantenernos firmes ante la defensa del euskera y ello pasa por apoyar al alumnado en su aprendizaje,TRUE
es,463,100,6.45,supone de facto tomar medidas para la mejora del aprendizaje de lengua castellana del mismo modo,TRUE
es,353,100,7.85,su aprendizaje personal auxiliar de conversación etcétera este señora consejera,TRUE
es,128,100,6.62,pero sin riesgo alguno se puede asegurar que sin necesidad de una prueba lingüística adicional,TRUE
es,463,88.06,6.45,tienen que darse los idiomas y no va a ser lo mismo en un centro que en otro no va a ser lo mismo en un centro que tenga el modelo quinientos que un centro que tenga el modelo a,TRUE
es,353,100,9.22,las denuncias que diariamente podríamos hacer y traer aquí igual ocupamos todos los plenos de la cámara solo del lenguaje utilizado,TRUE
es,423,100,4.14,de crecimiento del euskera reprochó así mismo la señora mendia,TRUE
es,545,100,8.34,a ustedes no les gustan e i te be ni el euskera ni las delegaciones internacionales del gobierno vasco que tanto valor aportan a nuestro tejido económico y social,TRUE
es,290,100,9.71,a los ciudadanos se les exija un perfil lingüístico en euskera o se le exija euskera únicamente cuando el trabajo que,TRUE
es,355,98.97,7.01,igual que el euskera el setenta y nueve coma cuatro de los niños en educación infantil cursan íntegramente en euskera,TRUE
es,480,100,6.33,independientemente de las situaciones lingüísticas de las comarcas y del índice de euskaldunización de los progenitores,TRUE
es,290,100,10.37,en euskera en otras ocasiones debe aparecer en los medios con mayor difusión en otros efectivamente también tiene que recogerse en medios,TRUE
es,353,100,10.17,en el conocimiento y en el uso del euskera pero todavía hay un millón y medio de vascos en nuestra comunidad que no conocen el euskera y usted quiere limitar sus derechos con esta ley,TRUE
es,189,98.68,4.89,pero acaso no se respetan los derechos lingüísticos en esta comunidad autónoma desde luego,TRUE
es,353,100,9.81,se llama limitar los derechos fundamentales de las personas no otro no que una señal de tráfico esté en euskera o en castellano,TRUE
es,58,96.88,5.74,que haya leído la constitución española y que habla de la riqueza de las distintas modalidades lingüísticas de españa,TRUE
